Product Name,Brand,Final Price,Discount,Rating
MCaffeine Coffee Under Eye Cream for Dark Circle & Puffiness Reduction with Hyaluronic Acid & Vit E,MCaffeine,297,15,4.1
"Lakme Matte Sunscreen SPF 50 PA+++, Niacinamide,UVA/B Protection,For Normal To Oily Skin",Lakme,438,30,4.3
Clinique Take The Day Off Cleansing Balm (Makeup Remover),Clinique,3800,0,4.6
"Aveeno Daily Moisturising Lotion - Natural Oat Body Moisturizer For Normal, Dry & Sensitive Skin",Aveeno,1099,13,4.5
Chemist At Play Lactic Acid Exfoliating Body Wash (236)& AHA Underarm Roll OnShower gel & Deo Combo,Chemist at Play,649,19,4.5
PIXI Glow Tonic Exfoliating Toner With Glycolic Acid,PIXI,1550,0,4.4
"Be Bodywise 5% Lactic Acid Body Lotion - For 24H Moisturization, Improved Skin Texture, Smooth Skin",Be Bodywise,399,20,4.3
Himalaya Purifying Neem Face Wash,Himalaya,449,25,4.5
Plix 2% Alpha Arbutin Pineapple Serum for Pigmentation & Dark Spot Reduction,Plix,529,8,4.1
"Lakme Peach Pro Ceramide Moisturizer, For Dry Skin, Normal Skin & Sensitive Skin",Lakme,427,40,4.5
Aroma Magic Under Eye Gel Brightens And Refreshes,Aroma Magic,212,10,4.2
Minimalist 6% Oat Extract Gentle Cleanser With Hyaluronic Acid For Sensitive Skin,Minimalist,284,5,4.4
"Dr. Sheth's Ceramide & Vitamin C Oil - Free Moisturizer to Hydrate, Brighten Skin",Dr. Sheth's,314,10,4.4
Dot & Key Anti-Acne Salicylic Green Clay Face Mask For Dark Spots Redution & Balances Oil & Sebum,Dot & Key,468,15,4.4
"Plix Jamun Skincare Combo With Cleanser, Toner, Serum, Moisturizer & Spot Corrector For Women & Men",Plix,1350,40,4.3
Nykaa Wanderlust Body Scrub,Wanderlust,263,25,4.4
PLIX 10% Vitamin C Guava Face Serum for Skin Brightening & Even tone with Hyaluronic acid & Pentavitin,Plix,569,5,4.0
"Wishcare Super Bright C16 Vitamin C Face Serum - Niacinamide, Kojic Acid & 4-n-BR For Pigmentation",Wishcare,601,14,4.6
"The Derma Co 1% Hyaluronic Long Lasting Sunscreen SPF 50, PA++++ |6 hrs. Sun Protection For All skin",The Derma Co,571,12,4.3
Himalaya Moisturizing Aloe Vera Face Gel,Himalaya,72,20,4.4
Estee Lauder Advanced Night Repair Eye Supercharged Gel Creme With Hyaluronic Acid (Under Eye Care),Estee Lauder,5800,0,4.3
Minimalist 3% Polyhydroxy PHA Face Toner With Multi Biotics For Minimizing Pore Size & Hydrating Skin,Minimalist,474,5,4.4
Fixderma Nigrifix Cream,Fixderma,405,10,4.1
Biotique Morning Nectar Nourish & Hydrate Moisturizer,Biotique,319,25,4.4
Olay Regenerist Mico Sculpting Day Cream For Plump-Bouncy Skin With Hyaluronic Acid & Niacinamide,Olay,1619,10,4.4
Plum BodyLovin' Lily Miss Sunshine Sunscreen Body Lotion SPF 35 PA+++ For Tan Reduction & Hydration,Plum,366,14,4.5
"Plum 5% Niacinamide Face Serum With Amino Acid - Fades Blemishes For Bright Skin, Beginner-Friendly",Plum,545,9,4.4
Forest Essentials Facial Tonic Mist Pure Rosewater,Forest Essentials,1350,0,4.5
The Derma Co 15% AHA + 1% BHA Peeling Solution for Beginners for Glowing Skin In 10 Minutes,The Derma Co,449,10,4.3
Dot & Key Watermelon Cooling Icy Gel Moisturizer,Dot & Key,426,14,4.6
"Plum Green Tea Oil-Free Moisturizer With Niacinamide For Oily, Acne Prone Skin",Plum,428,9,4.4
Minimalist 25% AHA + 5% PHA + 2% BHA Exfoliating Peel Solution For Instant Glow & Soft Skin,Minimalist,664,5,4.4
Vaseline Gluta-Hya Dewy Radiance & Overnight Radiance Combo,Vaseline,515,30,4.4
"Deconstruct 5% Niacinamide Face Serum with Alpha Arbutin, For Acne Marks, Beginner Friendly",Deconstruct,573,18,4.3
Sol de Janeiro Bum Bum Jet Set,Sol de Janeiro,3200,0,4.4
Nykaa Skin Secrets Tea Tree & Salicylic Acid Acne Spot Patch,Nykaa Skin,75,25,4.0
Paula's Choice Skin Perfecting 2% Bha Liquid Exfoliant,Paula's Choice,3100,0,4.4
Minimalist 8% L-Ascorbic Acid Lip Treatment Balm,Minimalist,379,5,4.1
Bioderma Anti-Itching Balm-Atoderm Intensive Baume-Ceramides & Canola Oil-Eczema Prone Skin,Bioderma,1529,10,4.5
"Plix Vitamin C Face Wash Cleanser For Skin Brightening, Pro Vit B5 & Alpha Lipoic Acid For Skin Glow",Plix,351,12,4.2
L'Oreal Paris Hyaluronic Acid Line Filling Water Cream with Ceramides for Hydration & Barrier Repair,L'Oreal Paris,849,15,4.4
Sanfe Promise Face Acne Patch - Pack of 36 Pimple Healing Patch Absorbing Cover,Sanfe,123,27,4.0
"The Face Shop Rice Water Bright Foaming Cleanser, Face Wash For Glowing Skin & Even Skin Tone",The Face Shop,370,0,4.3
Wishcare Pure & Natural Kannauj Rose Water For Skin Face & Hair - Rose Water Spray Face Toner,Wishcare,347,13,4.5
"Cetaphil Hydrating Foaming Face Wash For Men, Cleanser With Niacinamide & Aloe Pollution Defense",Cetaphil,956,9,4.5
COSRX Low pH Good Morning Gel Cleanser,COSRX,850,0,4.5
Dot & Key Vitamin C + E CSMS Routine for All Skin Types,Dot & Key,1507,20,4.4
Charlotte Tilbury Charlotte's Magic Cream,Charlotte Tilbury,6800,0,4.4
Dot & Key Watermelon Cooling Sunscreen Body Spray With SPF 50+ PA+++,Dot & Key,536,10,4.4
"The Face Shop Rice Water Bright Light Cleansing Oil, Makeup Remover On Heavy Makeup & Impurities",The Face Shop,549,0,4.4
Dot & Key Cica + Niacinamide C + E CSMS Routine for Oily & Acne Prone Skin,Dot & Key,1430,20,4.4
Ponds Super Light Gel Oil Free Moisturiser With Hyaluronic Acid + Vitamin E - Pack Of 2,Ponds,797,33,4.5
Aqualogica Detan+ Dewy Lightweight Sunscreen Gel SPF 50+ PA++++ for Normal & Dry Skin,Aqualogica,404,10,4.4
"The Derma Co 2% Kojic Acid Face Serum for Dark spots reduction, Pigmentation & Blemishes",The Derma Co,237,5,4.2
Biotique Bio Cucumber Pore Tightening Toner With Himalayan Waters,Biotique,208,20,4.3
"Hyphen Tinted Lip Balm - Marshmallow, 1% Vit E, 2% Squalane & Peptides, Brightens & Moisturizes",Hyphen,379,5,4.2
The Derma Co 1% Kojic Acid Lip Balm with SPF 30 PA++ for Pigmentation and Dry Lips,The Derma Co,296,10,4.2
"Neutriderm Moisturising Face & Body Lotion For Dry, Aging, Wrinkles, Acne, Red Skin With Vitamin E",Neutriderm,1000,0,4.5
"Dot & Key Vitamin C + E Lip Plumping Mask For Soothes Dryness, Pigmentation & Glowing Lips",Dot & Key,207,20,4.3
"Deconstruct Oil-Free Moisturizer With 3% NMF Complex & 0.2% Panthenol, Lightweight & Hydrating",Deconstruct,321,8,4.3
Dr. Althea 345 Relief Cream,Dr.Althea,2499,0,4.9
"Dot & Key Strawberry Dew Do-It-All Moisturizer Niacinamide, Peptides & Hyaluronic acid, Non-Sticky",Dot & Key,347,13,4.4
Minimalist Vitamin B12 + Repair Complex 5.5% Face Moisturizer With Ceramides for Barrier Repair,Minimalist,379,5,4.6
Dr. Sheth'S Haldi & Hyaluronic Acid Sunscreen Spf 50+ Pa+++ For All Skin Type,Dr. Sheth's,449,10,4.4
Foxtale Overnight Glow Mask Glycolic & Lactic Acid,Foxtale,476,20,4.2
"Dr. Sheth's Ceramide & Vitamin C Oil - Free Moisturizer to Hydrate, Brighten Skin",Dr. Sheth's,527,12,4.4
Ponds Light Moisturiser Non-Oily Fresh Feel With Vitamin E + Glycerine,Ponds,393,40,4.4
Chemist At Play AHA Body Lotion With Niacinamide Shea Butter Moisturizer For All Skin Types,Chemist at Play,369,8,4.5
Simple Kind to Skin Moisturizing Facewash Mild Face Wash for Sensitive Skin,Simple,357,15,4.4
La Shield Fisico SPF 50+ PA+++ Mineral Sunscreen No Chemical Filter For Sensitive Skin,La Shield,638,15,4.2
Biore UV Aqua Rich Watery Essence Sunscreen SPF 50+ PA++++,Biore,1070,0,4.5
"Forest Essentials Delicate Facial Cleanser Mashobra Honey, Lemon & Rosewater",Forest Essentials,1295,0,4.5
Lotus Herbals Whiteglow Skin Whitening & Brightening Gel Creme Spf 25 Pa+++,Lotus Herbals,377,18,4.5
Aestura Atobarrier365 Cream,Aestura,1400,0,4.7
NIVEA 48H Deep Moisture Care Cocoa Butter & Vit E Body Lotion For Very Dry Skin,NIVEA,452,20,4.5
O3+ Facialist Mask,O3+,155,0,4.4
Vaseline Healthy White Lightening Body Lotion,Vaseline,300,40,4.4
Hyphen 7% Ceramides-NMF Face Toner Essence | 5% Glass Skin Blend with Rice Water-100ml,Hyphen,470,5,4.5
DIOR Addict Lip Glow,DIOR,4400,0,4.5
"Foxtale 0.15% Encapsulated Retinol Night Serum Boosts Collagen, Treats Fine Lines & Wrinkles",Foxtale,479,20,4.3
"Heliocare Color Gel Cream Tinted Sunscreen SPF 50 Uva & Uvb Protection, No White Cast, Dewy Finish",Heliocare,1650,0,4.5
Beauty of Joseon Glow Replenishing Rice Milk,Beauty of Joseon,1570,0,4.5
Pilgrim 10% Niacinamide Face Serum For Acne Marks,Pilgrim,506,15,4.7
Conscious Chemist Berry Bright Niacinamide Sunscreen SPF 50 PA++++ With Water Resistant & No White Cast,Conscious Chemist,349,30,4.4
Beauty of Joseon Ginseng Cleansing Oil,Beauty of Joseon,1740,0,4.4
Victoria's Secret Bare Vanilla Fragrance Lotion,Victoria's Secret,1874,25,4.4
Cetaphil Gentle Cleansing & Moisturizing Combo,Cetaphil,1010,8,4.5
"Lakme Sun Expert Tinted Sunscreen SPF 50 PA +++, Broad Spectrum UVA/B protection",Lakme,438,30,4.3
"DHC Beauty Deep Cleansing Oil, Makeup Remover For All Skin Types",DHC Beauty,578,2,4.4
"SunScoop Hydrating Face & Body Fluid Sunscreen Spray, SPF 60 PA++++, Sunscreen for Dry & Oily Skin",SunScoop,399,20,4.2
PLIX 2% Salicylic Acid Jamun Active Acne Control Dewy Serum for Active Acne & Dark Spot Reduction,Plix,479,9,4.2
"Nua Pimple Patch Acne Control, Hydrocolloid And Salicylic Acid 36 Patches",Nua,149,6,4.1
Clinique Moisture Surge Intense 72H Lipid-Replenishing Hydrator,Clinique,3550,0,4.4
LANEIGE Lip Care Set (Mango Lip Glowy Balm And Berry Lip Sleeping Mask),LANEIGE,999,0,4.6
"Plum E-Luminence Simply Supple Cleansing Balm- Non-Drying Face, Lip & Eye Waterproof Makeup Remover",Plum,523,9,4.5
O3+ Shine & Glow Facial Kit for Instant Glowing Skin | Unisex Facial Kit for All Skin Types,O3+,650,7,4.3
Minimalist Retinol 0.6% Anti Aging Mid-Strength Formula For Fine Lines & Wrinkles,Minimalist,617,5,4.4
"Nat Habit Natural Sun Dried Bath Loofah, Body Sponge, Scrubber for Men & Women, Sustainable Handmade",Nat Habit,190,20,4.3
Swiss Beauty Kiss Kandy Lip Balm,Swiss Beauty,101,15,4.4
Neutrogena Deep Clean Facial Cleanser Face Wash for Normal to Oily Skin,Neutrogena,460,12,4.4
"d'you Hustle Serum With 5% Niacinamide, Hyaluronic Acid, Vitamin C For Acne & Pigmentation",d'you,3200,0,4.3
Charlotte Tilbury Charlotte's Magic Serum Crystal Elixir,Charlotte Tilbury,8850,0,4.4
COSRX Bestseller Combo,COSRX,2790,10,4.5
Lakme Peach Milk Moisturizer Vitamin E + SPF 30 PA++,Lakme,329,40,4.4
Dermatouch Dailyglow Bright & Even Skin Tone Face Wash,Dermatouch,223,20,4.4
Glow & Lovely Advanced Multi Vitamin Face Cream,Glow & Lovely,70,0,4.4
Pilgrim Squalane Glow Moisturizer with Niacinamide & Vitamin C,Pilgrim,446,19,4.3
The Derma Co X Dr. V Skin Renew Peptide Retinol Serum Cream,The Derma Co,1519,5,4.5
LANEIGE Water Sleeping Mask EX,LANEIGE,638,25,4.5
Neutrogena Deep Clean Gentle Foaming Cleanser - Moisturizing Face Wash for Normal to Sensitive Skin,Neutrogena,304,12,4.5
Rom&nd Glasting Melting Lip Balm,Rom&nd,940,0,4.8
Lakme Blush & Glow Sheet Mask,Lakme,67,33,4.4
The Derma Co 5% Niacinamide Face Serum With Alpha Arbutin & Multivitamin For Clear & Spotless Skin,The Derma Co,449,10,4.3
"Deconstruct 5% Niacinamide + 2% Alpha Arbutin Serum for Acne Marks & Pigmentation,For All Skin Types",Deconstruct,573,18,4.3
Cosrx Master Patch Original Fit - Pack Of 24,COSRX,252,10,4.3
"Deconstruct Fluid Brightening Sunscreen SPF 50+ PA++++ for Dry Skin, Hydrating & 8-Hour Long-Lasting",Deconstruct,367,8,4.2
LANEIGE Lip Sleeping Mask Ex Gummybear,LANEIGE,540,10,4.7
Earth Rhythm Glow Surge Sunscreen Spray SPF 50,Earth Rhythm,279,20,4.2
"Foxtale Refreshing Face Wash with Niacinamide & Vitamin E, Deeply Cleans Pores and Soothes Skin",Foxtale,212,15,4.3
COSRX Aloe Soothing Sun Cream SPF 50+ PA+++,COSRX,1050,0,4.4
"Dot & Key Blueberry Hydrate 12% Barrier Boost Serum With Ceramides, Niacinamide & Hyaluronic Acid For Barrier Repair",Dot & Key,509,15,4.6
Venusia Max Moisturiser Lotion For Dry Skin Contains Shea Butter 24 hrs Moisturization,Venusia,688,22,4.4
"PLIX 2% Niacinamide Jamun Moisturizer to Reduce Pimples for Oily & Acne Prone Skin, With Witch Hazel",Plix,379,20,4.3
"Plix 2% Salicylic Acid Acne Spot Corrector Gel For Reducing Active Acne, Controls Oil and Acne Scars",Plix,379,16,4.1
The Derma Co 2% Salicylic Acid Serum With Witch Hazel & Willow Bark For Active Acne Day+Night,The Derma Co,237,5,4.3
Mamaearth Ubtan Face Wash With Turmeric & Saffron For Tan Removal,Mamaearth,351,12,4.4
Lakme Perfect Radiance Night Cream 50g with Niacinamide,Lakme,419,30,4.4
Kiehl's Clearly Corrective Dark Spot Solution With Activated C & Buffered Salicylic Acid,Kiehl's,2600,0,4.3
Nykaa Naturals Skin Secrets Bestseller Sheet Mask - Monthly Pack,Nykaa Skin,350,30,4.5
O3+ Professional Pedi Bright Feet Mask Socks - Foot Care Mask for Detan and Deep Moisturisation,O3+,189,5,4.3
The Derma Co Oil-free Daily Face Moisturizer With Hyaluronic Acid Ceramides For Hydrated Skin,The Derma Co,314,10,4.3
"Dot & Key Rice Water Hydrating Toner with Hyaluronic for Oily, Sensitive Skin, Alcohol-Free",Dot & Key,320,19,4.3
LANEIGE Water Bank Blue Hyaluronic Cream Moisturizer,LANEIGE,2320,20,4.5
Bioderma Sensibio Gel Moussant SLS Free Cleanser With Vitamin E-24h Hydration-Micellar Gel,Bioderma,1439,20,4.4
SUGAR POP Nourishing Lip Balm,SUGAR POP,118,21,4.3
Ponds Hydra Miracle Super Light Gel With Hyaluronic Acid & Salicylic,Ponds,296,5,4.9
L'Oreal Paris Glycolic Bright Daily Foaming Face Cleanser With Glycolic Acid For Dull Skin,L'Oreal Paris,329,0,4.4
"Pilgrim 2% Alpha Arbutin & 3% Vitamin C Brightening Serum, Fades Pigmentation & Brightens Skin",Pilgrim,521,25,4.3
"Bio-Oil Skincare Infused with Rosemary for Stretch Marks, Scars & Ageing",Bio Oil,513,18,4.3
Nykaa Cosmetics Peptide Butter Bomb Lip Balm,Nykaa Cosmetics,584,10,4.3
"Brightening Body Lotion SPF 30 With Niacinamide & Vitamin C, Tan Protection & Glowing Skin",Foxtale,399,20,4.4
Hyphen Golden Hour Glow Sunscreen SPF 50 PA++++ for Dewy & Bright Skin High UVA/B Protection,Hyphen,522,5,4.1
"Pineapple Depigmentation Regime With Face Wash, Toner, Serum & Moisturizer",Plix,1148,30,4.2
Lancome Genifique Ultimate Skin Repair Serum With Beta Glucan,Lancome,1360,15,4.9
Plix 2% Alpha Arbutin Pineapple Moisturizer With SymWhite PLUS For Hyperpigmentation & Dark Spots,Plix,479,9,4.2
Ponds Youthful Miracle Anti Aging Night Cream With Retinol C Niacinamide,Ponds,597,35,4.4
The Body Shop Tea Tree Skin Clearing Facial Wash,The Body Shop,582,35,4.4
Dot & Key Vitamin C + E In The Spotlight Strobe Cream,Dot & Key,297,14,4.3
Typsy Beauty Glaze Pout Polish Peptide Lip Treatment Balm,Typsy Beauty,664,5,4.4
"Kama Ayurveda Kumkumadi Youth - Revitalising Facial Oil, For Uneven Skin & Dark Spot Removal",Kama Ayurveda,1895,0,4.3
"Dr. Sheth's Liquorice & 8.8% Lactic Acid (AHA) Chemical Peel For Even-Toned, Glowing Skin I 30g",Dr. Sheth's,404,10,4.3
"Olay Retinol 24 Max Anti Ageing Night Cream, Visibly Reduces Wrinkles In 7 Nights, Fragrance Free",Olay,1429,35,4.4
SKIN1004 Madagascar Centella Poremizing Quick Clay Stick Mask,SKIN1004,1709,10,4.2
"The Derma Co Pore Minimizing Face Serum With 4% Niacinamide, 5% PHA And P-refinyl For Open Pores",The Derma Co,527,12,4.2
Minimalist HOCL Skin Purifying Spray-150 ppm Face & Body Spray,Minimalist,379,5,4.5
"Neutrogena Hydro Boost Hyaluronic Acid Water Gel Face Moisturizer Refill For Normal, Dry & Oily Skin",Neutrogena,990,0,4.6
"Lotus Herbals Youthrx Anti-Ageing Transforming Creme, SPF25 PA+++, With Gineplex Youth Compound",Lotus Herbals,644,18,4.4
PAC Aqua Blast - Water Based Moisturizer,PAC,895,0,4.4
Bioderma Shower Oil - Atoderm Huile De Douche With Niacinamide,Bioderma,2295,10,4.5
"Lakme Absolute Day-N-Night Luminance Kit (Face Wash, Day Cream & Night Cream)",Lakme,774,34,4.3
Foxtale Aquamarine Oil Free Hydrating Moisturiser With Hyaluronic Acid For Normal To Oily Skin,Foxtale,304,23,4.2
Plum Saffron & Kumkumadi Oil Glow Bright Moisturizer For Dull Skin With SPF 35 UVA & UVB Protection,Plum,378,9,4.3
Nykaa Serial Kisser Moisturising Tinted Lip Balm With Shea Butter & Vitamin E,Nykaa Cosmetics,139,30,4.1
Dermatouch Bright & Even Skin Tone Face Wash,Dermatouch,120,20,4.4
Simple Water Boost Hydrating Gel Creme 100 HR Hydration,Simple,324,20,4.4
The Ordinary Soothing & Barrier Support Serum,The Ordinary,1850,0,4.4
Earth Rhythm Sunstick,Earth Rhythm,439,20,4.4
Nykaa Makeup Remover Wipes - 30 Wipes (Length - 20cm x Width - 15cm),Nykaa Cosmetics,239,20,4.5
Aqualogica Illuminate + Hydra Gel Moisturizer With Alpha Arbutin For 24 Hour Intense Hydration,Aqualogica,449,10,4.4
O3+ Bridal Facial Kit Vitamin C for Glowing Skin with Niacinamide | For All Skin Types,O3+,893,7,4.4
L'Oreal Paris Glycolic Bright Dark Circle Eye Serum With 3% Glycolic + Niacinamide + Vitamin C,L'Oreal Paris,699,0,4.3
Pilgrim 15% Vitamin C Face Serum For Advanced Brightness,Pilgrim,463,15,4.5
The Derma Co Micro-tip Acne Patches With Salicylic Acid and Hydrocolloid For Clean & Clear Skin - 24 Patches,The Derma Co,539,10,4.3
Cetaphil Sun SPF 30 Light Gel Mineral Base For Normal Sensitive & Oily Skin,Cetaphil,1182,10,4.3
The Derma Co Snail Peptide 96 Under Eye Repair Cream with Snail Mucin & Peptide Complex,The Derma Co,359,10,4.3
Neutrogena Visible Repair Anti-Ageing Retinol + Peptide Night Face Serum For Wrinkles & Fine Lines,Neutrogena,1399,13,4.5
Beauty Of Joseon Matte Sunscreen Stick Mugwort + Camelia SPF 50 PA++++,Beauty of Joseon,1570,0,4.4
Chemist at Play 10% Vitamin C Face Serum Brightens Skin Treats Dark Spots & Hyperpigmentation,Chemist at Play,599,25,4.7
Dr. Sheth's Kesar & Kojic Acid Oil-Free Moisturizer I Intense Hydration & Pigmentation Free Skin 50g,Dr. Sheth's,314,10,4.3
WILDGLOW Korean Glass Skin Bio-Collagen Overnight Face Mask,WILDGLOW,1804,5,4.8
"CeraVe Resurfacing Retinol Serum, Reduces Acne Marks with Licorice Root Extract & Niacinamide",CeraVe,1500,0,4.7
"Neutrogena Hydro Boost Face Sunscreen SPF50+ PA++++ Hyaluronic Acid, Niacinamide,Oily Sensitive Skin",Neutrogena,1199,8,4.8
Foxtale Hydrating Ceramide Supercream Moisturizer With Hyaluronic Acid,Foxtale,334,25,4.3
Dr. Sheth's Kesar and Kojic Acid Sunscreen with SPF 50+ PA++++ for Pigmentation and All Skin Types,Dr. Sheth's,629,10,4.3
"Cerave AM Facial Moisturizing Lotion With Sunscreen SPF 50 UVB + UVA, Dermatologist Recommended Day Cream",CeraVe,1425,5,4.4
Lotus Professional Phyto-Rx Rejuvina Herbcomplex Protective Lotion SPF 15,Lotus Herbals,529,18,4.5
"Forest Essentials Kumkumadi Night Cream - Night Face Cream with Vitamin C, Kumkumadi Tailam",Forest Essentials,2850,0,4.4
Ponds Pure Detox Anti-Pollution Purity Face Wash With Activated Charcoal,Ponds,315,45,4.5
Deconstruct Lightweight Gel Sunscreen SPF 55+ PA+++,Deconstruct,475,15,4.4
Foxtale On the Glow Travel Kit,Foxtale,674,25,4.0
Nykaa Wanderlust French Lavender Floral Fragrance Moisturising Body Lotion With Lavender & Cedarwood,Wanderlust,440,20,4.4
"Foxtale Acne Control Cleanser with Salicylic Acid & Niacinamide, Controls Oil & Fights Acne",Foxtale,262,25,4.3
Nykaa Naturals Korean Sheet Mask with Turmeric & Vitamin C For Brightening,Nykaa Skin,80,20,4.4
"Mamaearth Aloe Vera Gel with Pure Aloe Vera & VitaminE for Skin & Hair 300ml| Hydrates, Soothes Skin",Mamaearth,293,8,4.4
The Derma Co 1% Hyaluronic Sunscreen Oil-Free Gel With Spf 50 Pa++++ For Oily & Acne-Prone Skin,The Derma Co,424,15,4.3
"Foxtale Rapid Spot Reduction Drops With 3% Tranexamic Acid & Niacinamide, Treat Marks & Pigmentation",Foxtale,476,20,4.2
Lakme Sun Expert Dry Matte Fluid SPF 50 PA++++ Sunscreen With 1% Niacinamide & Ceramide,Lakme,349,30,4.8
Dot & Key Pink Clay Face Mask For Glowing Skin With Vitamin C- Fades Dark Spots,Dot & Key,468,15,4.4
Aqualogica Illuminate+ Dewy Lightweight Sunscreen Gel SPF 50+ PA++++ for All Skin Types,Aqualogica,527,12,4.5
Blue Heaven Jelly & Butter Hydrating Lip Balm,Blue Heaven,156,22,4.4
"Numbuzin No.5 Vitamin-Niacinamide Concentrated Pad, Brightening Korean Toner Pads, TXA & Glutathione",Numbuzin,2100,0,4.5
Bioderma SPF 50+ Sunscreen Invisible Photoderm Creme For Normal To Dry Senstive Skin No White Cast,Bioderma,989,10,4.3
Dermalogica Daily Microfoliant Face Scrub,Dermalogica,1050,0,4.5
"PLIX SPF 50+ Guava Glow Invisible Sunscreen Gel For UV A, UV B Protection with Ceramides and Vit C",Plix,329,23,4.1
MCaffeine Berries Brightening Coffee Face Scrub,MCaffeine,232,7,4.6
Glamveda Rice & Ceramide Korean Glass Skin Peel Off Mask,Glamveda,204,32,4.2
d'you Unkissed Serum Sunscreen SPF 70+ & PA++++ Mini,d'you,2200,0,4.2
The Derma Co Sali-Cinamide Anti-Acne Face Serum With 2% Salicylic Acid & 5% Niacinamide,The Derma Co,527,12,4.2
LANEIGE Lip Sleeping Mask Sweet Candy Ex,LANEIGE,540,10,4.6
Clean & Clear Foaming Face Wash - Hydrating Cleanser for Oily Skin & Reduces Acne In 7 Days,Clean & Clear,385,20,4.5
Lakme Perfect Radiance Brightening Facewash With 98% Pure Niacinamide Complexfor Pigmentation,Lakme,140,20,4.3
The Derma Co 1% Hyaluronic Sunscreen SPF 50 PA++++ Aqua Gel For Normal To Oily Skin,The Derma Co,839,30,4.5
Wishcare Vitamin C Pure Glow Face Sunscreen SPF 50 PA++++,Wishcare,399,20,4.4
"Bio-Oil Skincare Infused with Rosemary for Stretch Marks, Scars & Ageing",Bio Oil,800,18,4.4
"Lotus Herbals Youthrx Anti-Ageing Nourishing Night Creme, Reduces Fine Lines, All Skin Types",Lotus Herbals,677,18,4.4
Bioderma Brightening Cream - Pigmentbio Sensitive Areas - External Intimate & Friction Care,Bioderma,1439,10,4.3
O3+ Blueberry D-TAN Face Pack for Tan Removal & Glowing Skin - Detan Mask for Dry Skin,O3+,1364,12,4.4
"CeraVe PM Facial Moisturizer Lightweight Night Cream with Ceramides, Niacinamide & Hyaluronic Acid",CeraVe,1235,5,4.4
"Cetaphil Optimal Hydration Daily Cream, Lightweight, Skin Barrier Protection with Hyaluronic Acid",Cetaphil,1195,8,4.3
Neutrogena Deep Clean Blackhead Eliminating Face Scrub & Exfoliator with Salicylic Acid,Neutrogena,405,10,4.4
Neutrogena Hydro Boost Cleanser Water Gel Face Wash with Hyaluronic Acid for Normal & Sensitive Skin,Neutrogena,1099,5,4.5
L'Oreal Paris Glycolic Bright Night Cream With Glycolic Acid & Niacinamide Skin Brightening Cream,L'Oreal Paris,399,0,4.3
DIAM BEAUTY Glass Tint Lip Balm,DIAM BEAUTY,809,10,4.1
Simple Kind To Skin Micellar Water For Makeup Remover,Simple,360,20,4.4
Re'equil 0.5% Retinol Night Cream,Re'equil,499,5,4.5
Lotus Herbals Professional PhytoRx Whitening & Brightening Day & Night Combo,Lotus Herbals,1264,20,4.3
Wishcare Detan Combo Sunscreen SPF 50 Broad Spectrum & 10% AHA + 1% BHA Body Lotion,Wishcare,758,24,4.4
"Plum Green Tea & Zinc Matte SPF 50 Sunscreen Gel For Oily, Normal, Combination & Dry Skin",Plum,387,9,4.5
Aveeno Skin Relief Moisturising Lotion - Oat + Shea Butter Body Moisturizer For Dry & Sensitive Skin,Aveeno,1379,12,4.5
Bioderma SPF 50+ Tinted Sunscreen Photoderm Aquafluide Sunscreen Active Sun Defence - Claire Light,Bioderma,1664,10,4.2
Plum Niacinamide Bright & Clear Skin Combo,Plum,2144,15,4.4
"Dot & Key Strawberry Dew Deep Cleansing Balm For Face, Lip & Eye Waterproof Makeup Remover",Dot & Key,429,14,4.5
PLIX Pomegranate Peeling Solution For Glowing & Even Toned Skin with 25% AHA + 2% BHA + 5% PHA,Plix,558,14,4.1
Minimalist 5% Aquaporin Booster Face Wash With Hyaluronic Acid For Dry Skin,Minimalist,284,5,4.4
Hyphen 2% Ceramide-Peptide Complex Barrier Repair Moisturizer-Dry Skin Non-Comedogenic & Lightweight,Hyphen,449,10,4.3
"Plum BodyLovin' Vanilla Caramello Bestselling Body Lotion for Dry, Normal & All Skin type",Plum,323,14,4.5
Estee Lauder Advanced Night Repair Serum Duo,Estee Lauder,9000,0,4.5
Lakme No Makeup Must Haves Combo,Lakme,871,19,4.4
Cetaphil Cleansing + Hydrating Regime,Cetaphil,965,8,4.5
"Novology Acne Clearing Cleanser For Acne, Whiteheads And Blackheads, Suitable For Sensitive Skin",Novology,585,10,4.5
Lakme Retinol Advanced Renewal Day Creme Pro-Retinol Peptide Complex + Uv Filters & SPF 15 PA++,Lakme,699,30,4.3
"Lotus Herbals WhiteGlow Skin Brightening Gel Creme, SPF25 PA+++, Suits All Skin Types",Lotus Herbals,276,20,4.4
Underated Multipurpose Toning Solution With 8% Glycolic Acid + 1% Salicylic Acid + 1% GDL,Underated,286,18,4.3
Simple Protect N Glow Vitamin C Facial Wash,Simple,357,15,4.3
Wanderlust Japanese Cherry Blossom Scrub,Wanderlust,263,25,4.4
LANEIGE Water Bank Blue Hyaluronic Gel Moisturizer,LANEIGE,2320,20,4.4
"NIVEA Body Lotion, Aloe Hydration, with Aloe Vera, for Smooth, Hydrated Skin",NIVEA,599,25,4.5
O3+ Pedilogix Bubble Gum Manicure Pedicure Kit - Hands & Foot Care Kit,O3+,276,5,4.5
Eucerin Anti-Pigment Night Cream With Thiamidol Reduces Dark Spots & Night Regeneration,Eucerin,2448,15,4.2
"Plum BodyLovin' Marshmallow Melt Body Lotion With Shea Butter for Dry, Normal & All Skin type",Plum,409,14,4.4
L'Oreal Paris Revitalift Laser X3 Day Cream With Pro-Retinol,L'Oreal Paris,1427,15,4.4
Aqualogica Glow+ Dewy Lightweigh Sunscreen Gel SPF 50+ PA++++ with Papaya & Vitamin C,Aqualogica,819,18,4.5
Biotique Bio Sun Shield Sandalwood Ultra Protective Face Lotion SPF 50+ Sunscreen,Biotique,328,20,4.3
Dove Exfoliating Body Polish Scrub - Crushed Almond And Mango Butter,Dove,599,25,4.5
"Novology Acne Spot Corrector For Active Acne, Pimples And Whiteheads",Novology,595,15,4.6
"Plix 10% Niacinamide Jamun Face Serum for Acne marks, blemishes & oil control",Plix,529,8,4.1
Minimalist SPF 30 Lip Balm,Minimalist,284,5,4.3
MCaffeine D-Tan Exfoliating Coffee Face Scrub With Walnut & Vitamin E for Fresh & Glowing Skin,MCaffeine,314,10,4.5
Dot & Key Strawberry Dew Sunscreen Mist SPF 50+,Dot & Key,527,12,4.3
Biotique Fruit Brightening Face Wash,Biotique,240,25,4.3
Minimalist 2% Granactive Retinoid Anti Aging Face Cream With Vitamin E & HA,Minimalist,664,5,4.4
"The Body Shop British Rose Body Yogurt, 48-Hour Hydration , Rose & Shea Butter",The Body Shop,1101,15,4.5
Nykaa Serial Kisser Moisturising Lip Balm With Shea Butter & Vitamin E,Nykaa Cosmetics,104,30,4.0
Nykaa Naturals Rice Water and Glycolic Acid Gentle Exfoliation Face Wash,Nykaa Cosmetics,223,20,4.3
MCaffeine Coffee Hydrogel Under Eye Patches for Dark Circles with Hyaluronic Acid Depuffs,MCaffeine,679,15,4.3
"Sebamed Clear Face Foam, PH 5.5, Acne, Pimples & Blackheads, Montaline C40, Gentle Deep Cleanser",Sebamed,666,2,4.5
