Product Name,Brand,Final Price,Discount,Rating
LANEIGE Berry Bliss Lip Duo Mini,LANEIGE,1148,15,4.6
Hyphen 18% Brightening + 20% Collagen Double Serum,Hyphen,591,9,4.5
Plix Guava 10% Vitamin C Face Serum & Face Wash Combo,Plix,920,8,4.1
Plum 1% Salicylic Acid Foaming Face Wash - Fights Active Acne & Controls Oil For Smooth Skin,Plum,296,9,4.3
"Innisfree Green Tea Amino Acid Foam Cleanser - Hydrating, Soft & Rich Cleanser For Daily Use",Innisfree,680,15,4.5
Innisfree Tone Up No Sebum Sunscreen EX SPF 50+ PA++++ For Oil Control - Matte Finish,Innisfree,1050,25,4.1
Pilgrim Retinol Night Cream with Vitamin C & Hyaluronic Acid,Pilgrim,533,18,4.3
Forest Essentials Soundarya Radiance Day Cream with 24K Gold & SPF 30 PA++,Forest Essentials,2475,0,4.4
Nykaa Happy Heels Footcream,Nykaa Skin,187,25,4.4
Neutrogena Hydro Boost Nourishing Cream Moisturizer with Hyaluronic Acid + Ceramides For Dry Skin,Neutrogena,1259,7,4.4
"Hyphen Mango Lip Balm SPF50 PA++++ With 2% Kojic Acid, 1% Vit E & Vitamin C To Brightens Dark Lips",Hyphen,379,5,4.5
The Derma Co 2% Kojic Acid Face Cream For Pigmentation,The Derma Co,449,10,4.2
Amorepacific X Nykaa: Festive Radiance Gift Set,LANEIGE,1499,33,
"Dot & Key Cica, Green Tea & Niacinamide Calming Skin Clarifying Toner For Oily & Acne Prone Skin",Dot & Key,320,19,4.2
Lotus Herbals Radiant Gold Cellular Glow Facial Kit,Lotus Herbals,1136,18,4.4
The Ordinary Retinal 0.2% Emulsion,The Ordinary,1500,0,4.7
Biotique Bio Papaya Revitalizing Tan Removal Scrub,Biotique,239,20,4.4
"Olay Retinol 24 Max Anti Ageing Night Serum, Visibly Reduces Wrinkles In 7 Nights, Fragrance Free",Olay,1429,35,4.4
WOW Skin Science Aloe Vera Gel,WOW,301,33,4.4
Supergoop Unseen Sunscreen SPF 40 PA+++,Supergoop,3040,5,5.0
SUGAR Tipsy Lips Moisturizing Balm,SUGAR,165,17,4.4
Beauty Of Joseon Revive Serum For Skin Elasticy - Ginseng + Snail Mucin,Beauty of Joseon,1480,0,4.5
Dot & Key 10% Glycolic Watermelon Super Glow Face Serum For Pigmentation,Dot & Key,383,15,4.3
The Body Shop British Rose Petal Soft Hand Cream,The Body Shop,276,20,4.1
CeraVe Facewash & Moisturizer Combo with Ceramides - Daily Skincare Routine for Normal To Dry Skin,CeraVe,669,12,4.4
Mamaearth Vitamin C Daily Glow Sunscreen with Vit C & Turmeric for Tan Protection & Glow SPF50 PA+,Mamaearth,314,10,4.2
"The Derma Co 50000 PPM Vitamin C Microneedle Face Serum Shot for Radiant, Glowing Skin All Types",The Derma Co,1349,10,4.8
SunScoop 5% Niacinamide Daily Moisture Sunscreen Body Lotion SPF 50+ PA++++,SunScoop,399,27,4.8
Fixderma Shadow SPF 50+ Cream To Protect Broad Spectrum,Fixderma,510,15,4.4
"Olay Total Effects Night Cream, Fights 7 Signs Of Ageing With Niacinamide And Green Tea Extracts",Olay,899,10,4.4
e.l.f. Cosmetics Hydrating Core Lip Shine,e.l.f. Cosmetics,950,0,4.1
Minimalist 10% AHA BHA Exfoliator With Hyaluronic Acid For Even Tone & Texture,Minimalist,569,5,4.3
Mamaearth Rice Oil-Free Face Moisturizer With Rice Water & Niacinamide For Glass Skin,Mamaearth,287,10,4.3
"Plix Pineapple De-pigmentation Regime Facewash, Serum, Moisturizer & Sunscreen",Plix,1199,39,4.1
Wishcare Pure & Natural Aloe Vera Gel - Enriched With Vitamin E,Wishcare,279,30,4.4
Foxtale Daily Glow Combo - (Pack of 3),Foxtale,635,25,4.4
COSRX Ultra-Light Invisible Sunscreen SPF50 PA++++,COSRX,1350,0,4.5
O3+ D-TAN Facial Kit with Peel Off Mask for Tan Removal & Pigmentation | Suitable for All Skin Types,O3+,521,7,4.4
Nykaa Wanderlust Japanese Cherry Blossom Floral Sakura Fragrance Moisturising Body Lotion,Wanderlust,440,20,4.4
Hyphen Rice Water Brightening Daily Cleanser,Hyphen,269,10,4.3
Outshine Korean Glass Skin Serum - Brightening & Dark Spot Corrector,Chicnutrix,1395,0,4.0
Plum BodyLovin' Vanilla Vibes Sugar Body Scrub,Plum,473,14,4.4
La Shield Lite SPF 50 PA+++ Mineral Sunscreen Gel Reduces Pigmentation & Dark Spots Oil-free,La Shield,833,15,4.4
Earth Rhythm Hand Cream,Earth Rhythm,199,20,4.2
"Plum Niacinamide Toner & Serum Duo for Pore Care, Tightening & Brightening",Plum,671,15,4.4
"Uriage Thermal Water With Active Mineral Composition, Hydration & Moisturization For All Skin Types",Uriage,944,15,4.4
"The Formularx Barrier Relief Lightweight Ceramide Moisturizer For Oily, Acne-Prone, Sensitive Skin",The Formularx,594,15,4.9
The Ordinary Multi Peptide + HA Serum,The Ordinary,1700,0,4.5
Moody 7D Hydroburst Hyaluronic SPF 50 PA++++,Moody,330,45,4.5
Bronson Professional Pore Cleanser Blackhead Dermasuction Remover Battery Operated With 4 Nozzles,Bronson Professional,500,50,3.2
Dot & Key Strawberry On-The-Go SPF 50 Sunscreen Stick PA+++ For UVA/B Blocks,Dot & Key,565,5,4.1
"Plum 1% Retinol Anti-Aging Face Serum With Bakuchiol- Boosts Collagen, Reduces Fine Lines & Wrinkles",Plum,719,9,4.3
"Sebamed Lip Defense, For Dry And Chapped Lips, With SPF 30, With Jojoba Oil And Vitamin E",Sebamed,510,2,4.4
Anua Rice 70 Glow Milky Toner with Niacinamide & Ceramide For Glass Skin & Healthy Skin Barrier,Anua,1900,0,4.8
O3+ Brightening & Whitening Face Wash With Cucumber & Aloe Vera Extract All Skin Types,O3+,451,7,4.3
NIVEA Sun Protect & Dry Touch Invisible SPF 50 Spray,NIVEA,769,45,4.3
Vaseline Intensive Care Aloe Fresh Body Lotion,Vaseline,439,45,4.5
Biotique Bio Papaya Visibly Flawless Face Wash For All Skin Types,Biotique,288,20,4.4
Maybelline New York Baby Lips Color Balm,Maybelline New York,188,10,4.4
The Body Shop Vitamin C Glow Boosting Moisturizer Boosts Radiance & Hydrates Dull Skin All Skin,The Body Shop,2121,15,4.4
Anua Heartleaf 77% Soothing Toner,Anua,1900,0,4.9
"Nat Habit Five Oil Hibiscus Shampoo & Conditioner Combo For Hair Fall Control, 72 Hr Frizz Control",Nat Habit,636,30,4.4
Re'equil Ultra Matte Dry Touch Sunscreen SPF 50 PA++++,Re'equil,328,5,4.5
ETUDE HOUSE Ginger Sugar Melting Balm,ETUDE HOUSE,801,10,4.3
Forest Essentials Facial Tonic Mist with Pure Rosewater - Toner - Hydrates & Minimises Pores,Forest Essentials,595,0,4.5
Minimalist SPF 60 PA ++++ Sunscreen - Pregnancy & Lactation Safe For Sensitive Skin,Minimalist,569,5,4.3
Dot & Key Barrier Repair Essentials Duo,Dot & Key,515,20,4.4
Re'equil Oxybenzone And Omc Free Sunscreen SPF 50 PA+++,Re'equil,375,5,4.4
Lotus Herbals Radiant Gold Cellular Glow Facial Kit,Lotus Herbals,287,18,4.3
Plix FIX Jamun Clarifying Fruity Toner,Plix,379,11,4.3
TONYMOLY Korean Fresh Face Sheet Mask,TONYMOLY,100,0,4.6
Eucerin Anti-Pigment Dark Circle Eye Corrector Serum With Thiamidol & Hyaluronic Acid For Bright Eye,Eucerin,2035,15,4.0
Lotus Herbals Whiteglow 3-in-1 Deep Cleansing Skin Whitening Facial Foam,Lotus Herbals,242,18,4.4
Kama Ayurveda Kumkumadi Youth - Recovering Night Balm For Replenished & Radiant Skin,Kama Ayurveda,3750,0,4.2
Eucerin Pigment Control Sunscreen Fluid SPF50+ Has Thiamidol Prevent & Reduce Darkspot Is Nonsticky,Eucerin,1530,15,4.6
Dot & Key Bestselling Vitamin C Sun Protect Duo,Dot & Key,752,20,4.4
The Derma Co 2% Niacinamide Oily Skin Cleanser,The Derma Co,275,8,4.3
RAS Luxury Oils Super Recharge Night Cream With Bakuchiol & Peptides Deeply Hydrates,RAS Luxury Oils,2312,20,4.7
Celimax The Vita-A Retinol Shot Tightening Korean Serum,Celimax,2399,0,4.8
LANEIGE Cream Skin Cerapeptide Refiner Refill,LANEIGE,1360,15,4.6
"Cetaphil Optimal Hydration Lightweight Serum, Skin Barrier protection with Hyaluronic Acid",Cetaphil,781,8,4.3
"Bioderma Sebium Gel Moussant Actif Cleanser with Salicylic & Glycolic Acid for Acne Prone, Oily Skin",Bioderma,1259,30,4.5
Murad Retinol Youth Renewal Serum,Murad,7500,0,4.3
Dot & Key 2% Salicylic Cica Anti Acne Face Serum For Irritation & Unclogs Pores,Dot & Key,339,15,4.4
Ponds Hydra Miracle Super Light Gel With Hyaluronic Acid & Vitamin C,Ponds,425,35,4.8
Kiehl's Creamy Eye Treatment with Avocado,Kiehl's,3000,0,3.9
Neutrogena Ultrasheer SPF50+ PA+++ Ultra Light Face Sunscreen For Dry & Oily Skin Home+Travel Combo,Neutrogena,780,28,4.4
Foxtale CSMS Glow On Combo Kit,Foxtale,1234,35,4.6
Plum 1.5% Vitamin C Alcohol-Free Spray Toner With Mandarin & Witch Hazel For Glow Boost & Open Pores,Plum,387,9,4.4
COSRX Advanced Snail Radiance Dual Essence,COSRX,2550,0,4.5
"Anua Pdrn Hyaluronic Acid Capsule 100 Serum with Collagen For Plump, Dewy, Radiant Glass Skin",Anua,2100,0,4.6
"Hyphen 2% Kojic Acid Spf 30 Lip Balm With Vitamin C, 1% Vit E, Brightens Pigmented & Dark Lips",Hyphen,379,5,4.2
The Derma Co 30% Aha + 2% Bha Peeling Solution,The Derma Co,527,12,4.3
Re'equil 0.3% Retinol Night Cream,Re'equil,428,5,4.4
The Ordinary Salicylic Acid 2% Masque,The Ordinary,1450,0,4.4
Beauty of Joseon Radiance Cleansing Balm,Beauty of Joseon,1650,0,4.6
Dr. Sheth's Neem & Salicylic Acid Face Wash,Dr. Sheth's,321,8,4.3
Chemist at Play 2% Salicylic Acid Face Wash For Oily Skin with Niacinamide Oil Cleanser for Face,Chemist at Play,249,17,4.4
The Body Shop Vitamin E Moisture Cream,The Body Shop,1271,15,4.3
Nykaa Naturals Face Scrub,Nykaa Skin,187,25,4.3
NIVEA SPF 50+ PA+++ & Vit E Face Sunscreen- Instant & Waterproof Protection,NIVEA,719,20,4.2
Ponds Bright Beauty Anti-Pigmentation Serum with 12% Gluta- Niacinamide Complex,Ponds,354,35,4.3
Nykaa Naturals Skin Secrets Potent Ingredients Sheet Mask Combo (Pack Of 5),Nykaa Skin,350,30,4.5
The Derma Co 5% Nia-Ceramide Mattifying Moisturizer for Oily & Acne Prone Skin 100g,The Derma Co,395,12,4.4
"Eclipse Solaire Active Sunscreen SPF 50 PA+++ for All Skin Types, No White Cast",Eclipse Solaire,850,0,4.6
"Lotus Herbals Safe Sun Uv Screen Matte Gel Spf 50 Sunscreen, No white cast, Pa+++, 100gm",Lotus Herbals,480,18,4.3
Plum 10% Niacinamide Brightening Face Serum With Rice Water & Ferment - Fades Blemishes & Acne Marks,Plum,237,5,4.3
d'you Mini Bestsellers Trio (SMS Routine),d'you,2465,15,4.2
Hiphop Skin care Cleansing Charcoal Nose Strips for Women - Blackhead Remover & Pore Cleanser (3 Strips),Hiphop,99,21,4.1
"Dr. Sheths BTox Serum with Argireline & Copper Peptide For Fine Lines, Skin Firming & Even Tone",Dr. Sheth's,1319,12,5.0
SKIN1004 Madagascar Centella Hyalu-Cica Water-Fit Sun Serum,SKIN1004,2039,15,4.5
Mamaearth Rice Water Dewy Face Toner with 4% Niacinamide for Glass Skin and All Skin Types,Mamaearth,386,10,4.5
Simple Kind to Skin Replenishing Rich Moisturizer All Skin Types Moisturizer,Simple,380,20,4.4
LANEIGE Water Bank Blue Hyaluronic Cleansing Foam,LANEIGE,1448,20,4.6
Clinique Moisture Surge Duo (2 x 30ml),Clinique,4500,0,4.5
BiE O2wow!- Oxygenating & Firming Mask,BiE - Beauty In Everything,1869,15,4.2
Aminu Copper Peptide Serum (10ml),Aminu,1840,0,4.3
Forest Essentials Advanced Soundarya Age Defying Facial Serum With 24K Gold,Forest Essentials,5695,0,4.5
Earth Rhythm Aqua Surge Sunscreen Spray SPF 50,Earth Rhythm,279,20,3.9
"O3+ Meladerm Vitamin C Gel Bleach For Dullness Removal, Hydration & Glowing Skin, All Skin Types",O3+,747,10,4.1
Bioderma Ultra-Soothing Foaming Gel Atoderm Intensive Gel Moussant With Niacinamide,Bioderma,629,10,4.5
Orimii Bump Hydrating Body Butter for Reducing Stretch Marks - Pregnancy Safe,Orimii,660,5,4.1
Biodance Hydro Cera-Nol Real Deep Mask,Biodance,380,0,4.4
"Earth Rhythm Lip Masque With Peptide, Overnight Damage Repair Mask and Seals Hydration",Earth Rhythm,224,25,4.1
Jeva Papaya Tan Removal Scrub,Jeva,150,54,4.1
Lotus Professional Phyto-Rx Whitening & Brightening Night Creme,Lotus Herbals,652,18,4.4
Nykaa Clay It Cool Clay Mask,Nykaa Skin,359,40,4.3
Bioderma Atoderm Intensive Gel Creme Moisturizer,Bioderma,693,30,4.4
Beauty of Joseon Green Plum Refreshing Cleanser,Beauty of Joseon,1130,0,4.4
Fixderma Shadow SPF 30+ Gel,Fixderma,252,10,4.4
Clinique Liquid Facial Soap Mild - Dry Combination Facewash,Clinique,2500,0,4.5
Aroma Magic Bridal Glow Facial Kit for Single Use,Aroma Magic,149,10,4.4
FAE Beauty No White Cast Lightweight Sunscreen SPF Juice SPF 50+ PA++++,FAE Beauty,528,12,4.5
Dove Exfoliating Body Polish Scrub - Oatmeal & Calendula Oil,Dove,559,30,4.3
O3+ Brightening Facial Kit for Tan and Pigmented Skin,O3+,5208,7,4.2
LANEIGE Glowy Makeup Serum,LANEIGE,1520,20,4.4
Plum Green Tea Revitalizing Spray Face Mist With Glycolic Acid & Aloe Vera - Hydrates & Refreshes,Plum,328,9,4.5
Ponds Age Miracle Retinol Combo,Ponds,1091,40,4.4
The Ordinary Lactic Acid 10% + HA,The Ordinary,950,0,4.3
Foxtale Purify & Glow Cleanser + Mask With French Pink Clay & Sodium,Foxtale,296,25,4.4
"Neutrogena Visible Repair Retinol + Peptide Night Eye Cream For Anti-Ageing, Dark Circles & Wrinkles",Neutrogena,1399,7,4.5
MARS Aqua Splash Tinted Lip Balm,MARS,130,13,4.2
Dot & Key Lip Polish Exfoliating Sugar Scrub,Dot & Key,199,20,4.3
Aqualogica Illuminate + Hydra Gel Moisturizer With Alpha Arbutin For 24 Hour Intense Hydration,Aqualogica,284,5,4.5
Aqualogica Glow+ Hydra Gel Moisturizer With Papaya & Vitamin C For 24 Hour Intense Hydration,Aqualogica,449,10,4.4
Olay Natural White Instant Glowing Fairness Skin Cream with UV Protection,Olay,199,0,4.4
MCaffeine Coffee Hydrogel Under Eye Patches for Dark Circles with Hyaluronic Acid Depuffs,MCaffeine,449,10,4.4
O3+ Night Repair Cream - Moisturiser For Brightening & Glow Boosting | Fades Finelines & Wrinkles,O3+,840,12,4.2
Winston 3 In 1 LED Light Therapy Face Mask for Anti Ageing to Get Glowing Clear & Clean Skin,Winston,2149,38,4.3
Innisfree The Green Tea Seed Cream With Hyaluronic Acid For Soothing Skin,Innisfree,1424,20,4.5
The Derma Co 2% Salicylic Face Mask For Acne & Blemish Prone Skin,The Derma Co,539,10,4.4
"Deconstruct 0.2% Retinol Face Serum + 1% Peptide, Anti-Aging Serum, Beginner-Friendly",Deconstruct,615,23,4.4
Forest Essentials Sheer Sun Fluid Sunscreen SPF 50 PA++++,Forest Essentials,1575,0,4.5
KLOY Korean Style Bath Mitt for Exfoliation & Body Cleanser,KLOY,199,0,4.0
"Gabit 100% Mineral Sunscreen SPF 50 PA++++ With Vitamin E, No White Cast, Blue Light Protection",Gabit,466,5,4.0
Physiogel Daily Moisture Therapy - Face Moisturizer Cream,Physiogel,740,0,4.5
Neutrogena Ultrasheer SPF50+ PA++++ Moisturizing Face Sunscreen Oily & Sensitive Skin - Pack of 3,Neutrogena,598,33,4.4
Be Bodywise Body Sunscreen Spray SPF 50 PA+++,Be Bodywise,399,20,4.4
"Novology Bi-Phasic Serum For Hyperpigmentation, Dark Spots & Acne Marks, Dry - Combination Skin",Novology,723,15,4.3
"Deconstruct 10% Niacinamide + 0.3% Alpha Arbutin Serum For Dullness, Tan & Uneven Skin Tone",Deconstruct,559,20,4.3
"Foxtale Daily Glow Defense Tan-Free, Glowy & Sun-Protected Skin Combo",Foxtale,800,30,4.4
Sulwhasoo First Care Activating Serum VI,Sulwhasoo,5270,15,4.5
"The Face Shop Korean Jeju Aloe Vera Soothing Gel with Vitamin E for Face, Body & Hair",The Face Shop,466,5,4.6
Eucerin Oil Control Dry Touch Sunscreen Gel-Cream SPF 50+,Eucerin,979,25,4.3
Lotus Professional Phyto-Rx Whitening & Brightening Face Wash,Lotus Herbals,406,18,4.4
Simple Water Boost Micellar Facial Wash,Simple,357,15,4.5
PLIX Pomegranate 0.6% Retinol & 0.2% Bakuchi Oil Night Face Serum To Reduce Fine Lines,Plix,479,26,4.3
Dot & Key Blueberry Hydrate Barrier Repair Oil-Free Moisturizer,Dot & Key,347,13,4.5
Innisfree Dewy Tint Lip Balm With Hyaluronic Acid,Innisfree,935,15,4.5
"Hyphen Tinted Lip Balm- Vintage, 1% Vit E, 2% Squalane & Peptides, Brightens, Moisturizes Dry Lips",Hyphen,379,5,4.2
Lakme No Makeup Makeup Must Haves,Lakme,935,22,4.3
Plix Guava Glowy Lip Tinted Balm,Plix,279,20,4.1
"The Face Shop White Seed Serum With Niacinamide & Hyaluronic Acid, Fights Dullness & Blemishes",The Face Shop,1221,5,4.3
Lotus Herbals WhiteGlow Skin Whitening & Brightning Night Creme,Lotus Herbals,406,18,4.4
The Ordinary Natural Moisturizing Factors + HA,The Ordinary,700,0,4.3
Nykaa Naturals Korean Sheet Mask with Cica & Ceramide For Barrier Repair,Nykaa Skin,80,20,4.4
"PIXI FortifEYE Firming Under-Eye Patches with Collagen, Retinol & Caffeine",PIXI,2900,0,4.4
Plum Saffron & Papaya Glow Bright Gel Face Wash For Daily Use - Fights Dullness & Evens Skin Tone,Plum,237,14,4.3
"Moody Acnexpert Overnight Spot Correcting Pen Pimple Drying Lotion With Salicylic, Sulfur & Zinc",Moody,346,12,4.7
Bioderma SPF 50+ Tinted Sunscreen Photoderm Creme Teinte Claire Light SPF 50+ Water Resistant,Bioderma,1169,10,4.2
Minimalist 0.3% Ceramide Barrier Repair Moisturizing Cream For Oily Skin,Minimalist,569,5,4.3
Fixderma Tranexamic Acid + 2%Kojic Acid + 1%Arbutin SKARFIX TX Face Cream For Pigmentation,Fixderma,428,10,4.1
Sulwhasoo Concentrated Ginseng Renewing Cream Ex,Sulwhasoo,15215,15,4.5
COSRX BHA Blackhead Power Liquid,COSRX,1590,0,4.4
Foxtale The Dazzler Multivitamin Glow Toner + Makeup Setting Spray,Foxtale,296,25,4.4
Hyphen 2% Ceramide-Peptide Complex Barrier Repair Moisturizer-Oily Skin Non-Comedogenic & Lightweight,Hyphen,404,10,4.4
Wanderlust Japanese Cherry Blossom Body Butter,Wanderlust,450,18,4.4
Cetaphil Baby Daily Lotion With Organic Calendula for Face & Body,Cetaphil,1487,7,4.5
Forest Essentials Luscious Lip Balm With Organic Beeswax For Dry Chapped Lips,Forest Essentials,850,0,4.2
"The Formularx Barrier Plus Peptide Ceramide Moisturizer For Dry, Normal, & Sensitive Skin",The Formularx,594,15,5.0
"The Face Shop Pomegranate And Collagen Serum, With 10% Collagen & Hyaluronic Acid, For Skin Firming",The Face Shop,2025,10,4.4
NIVEA Shea butter Lip Balm with Natural oils & 24H melt-in moisture-Original care,NIVEA,166,5,4.5
NIVEA Soft Daily UV Light Moisturising Cream,NIVEA,312,40,4.5
Plum Bodylovin' Best Of Vanilla Vibes Combo,Plum,1464,20,4.4
The Derma Co Tran-Zelaic Pigmentation Corrector Serum With 10% Azelaic Acid,The Derma Co,571,12,4.2
"Plum Rice Water & 3% Niacinamide Sheer-Tinted Sunscreen With SPF 50 PA++++, For Oily to Dry Skin",Plum,454,9,4.3
Dove Revitalizing Body Wash With Scented Peach And Vitamin C,Dove,462,23,4.4
LANEIGE Cica Sleeping Mask,LANEIGE,713,25,4.5
e.l.f. Cosmetics Glow Reviver Melting Lip Balm,e.l.f. Cosmetics,1050,0,4.8
Mamaearth Rice Facial Kit With Rice Water & Niacinamide For Glass Skin,Mamaearth,359,10,4.2
Victoria's Secret Velvet Petals Fragrance Lotion,Victoria's Secret,1874,25,4.5
Hyphen The #JuicyLipsOrNothing Gift Kit For 24 Hrs Moisturization & Hydration 3 Tinted Lip Balms,Hyphen,1077,10,4.2
"Dr. Sheth's Tea Tree & Lactic Acid Body Lotion Provides Even Skin Tone, Reduce Body Acne",Dr. Sheth's,284,5,4.3
Plum Candy Melts Vegan Lip Balm,Plum,268,9,4.4
"Sirona Natural Bamboo Charcoal Nose Strips For Women, Removes Blackheads,Whiteheads & Pore Cleanser",Sirona,121,19,4.1
Lacto Calamine Oil Balance Lotion (For Oily Skin),Lacto Calamine,160,3,4.3
Cetaphil Bright Healthy Radiance Gentle Renewing Cleanser,Cetaphil,865,7,4.4
The Derma Co 1% Kojic Serum-Gel with Arbutin for Night Repair,The Derma Co,533,11,4.3
Aqualogica Radiance Fluid Sunscreen SPF50+ PA++++ with Niacinamide & Watermelon For Oily Skin,Aqualogica,404,10,4.6
The Derma Co 2% Salicylic Acid Gel Face Wash for Oily Skin with Salicylic Acid & Witch Hazel,The Derma Co,275,8,4.8
Dot & Key Multi Peptide Pomegranate & Ceramides SPF 30 Face Moisturizer For Wrinkles,Dot & Key,426,14,4.3
SUROSKIE Rose Glass Skin Mist 100ml | 2 in 1 Face Tonner + Makeup Setting Spray | Enriched With Rose Water & Aloe Vera | For Glowing & Hydrating Skin | All Skin Types | Rose Face Mist For Men & Women,SUROSKIE,1199,0,4.4
Neutrogena Ultrasheer SPF50+ PA+++ Ultra Light Face Sunscreen For Dry & Oily Skin Super Value Pack,Neutrogena,1175,25,4.4
The Derma Co 1% Salicylic Acid Oil-free Moisturizer for Face With Oat Extract For Active Acne,The Derma Co,314,10,4.3
Lakme Retinol Advanced Renewal Night Gel Creme Pro-Retinol Peptide Complex,Lakme,769,30,4.3
Lotus Herbals Phyto-Rx Skin Firming Anti-Ageing Creme SPF 25 Pa+++,Lotus Herbals,791,18,4.4
Re'equil Oil Free Mattifying Moisturising Gel,Re'equil,280,5,4.3
Cetaphil Skin Care Regime For Oily Skin,Cetaphil,1213,8,4.4
Kama Ayurveda Rose Jasmine Face Cleanser (Face Wash),Kama Ayurveda,1525,0,4.5
Bath & Body Works Dark Kiss Super Smooth Body Lotion,Bath & Body Works,1299,41,4.4
PIXI Hydrating Rose Glow Mist,PIXI,1690,0,4.5
Chemist at Play Hydrating & Anti Aging Under Eye Cream for Dark Circles & Puffiness,Chemist at Play,299,14,4.1
"Hydrating Body Wash With Hyaluronic Acid & Ceramides, Locks In Moisture, Reduces Body Odour",Foxtale,279,20,4.4
Estee Lauder Revitalizing Supreme+ Night Intensive Restorative Creme,Estee Lauder,6800,0,4.6
O3+ Radiant Day Cream Moisturiser SPF30 for Brightening & Glowing Skin | All Skin Types,O3+,924,12,4.2
"Innisfree Volcanic Pore Clay Mask - Cool Mint Choco, Clogged Pores, Oil Control, Blackhead",Innisfree,990,10,4.8
Dot & Key 0.2% Retinol Complex Face Serum With Niacinamide & Multi-Peptides - Beginner-Friendly,Dot & Key,509,15,4.5
Ozone D-tan Face Pack,Ozone,252,20,4.5
Forest Essentials Transformative Soundarya Night Cream with 24K Gold,Forest Essentials,3375,0,4.3
Episoft Cleansing Lotion For Sensitive & Dry Skin Makeup Cleanser,Episoft,528,12,4.4
Beautiliss Ice Roller Face Massager (Color May Vary),Beautiliss,96,61,4.1
Innisfree Perfect 9 Intensive Cream EX,Innisfree,3060,10,4.5
The Ordinary Granactive Retinoid 2% Emulsion,The Ordinary,1200,0,4.5
Olay Regenerist Revilatising Hydration Day Cream With Spf 15 For Plump Skin With Niacinamide,Olay,1349,10,4.4
Plum Bulgarian Rose And 1% Hyaluronic Acid Dew-It-Light Gel Cream,Plum,454,9,4.7
Renee Cosmetics Lumi Glow Highlighting SPF 50 Sunscreen,Renee Cosmetics,499,0,4.3
Biotique Bio Neem Purifying Face Wash Prevents Pimples For All Skin Types,Biotique,239,20,4.4
Hyphen 10% Power Peptide Cocktail Serum,Hyphen,759,5,4.2
TNW The Natural Wash 100% Steam Distilled Rose Water Face Toner Spray Gulab Jal Hydration,TNW The Natural Wash,449,25,4.5
Brightening and Hydrating Korean Skincare Combo,COSRX,4500,10,4.5
"TONYMOLY Korean Tea Tree Pore Fresh Toner to Soothe, Purify & Control Oily Skin",TONYMOLY,1309,15,4.5
"The Face Shop Rice & Ceramide Moisturizing Skincare Set, Complete Travel Friendly Skincare Routine",The Face Shop,836,7,4.3
La Shield Pollution Protect SPF 50 Mineral Sunscreen Lightweight & Oil free Moisture Boost,La Shield,289,15,4.1
Foxtale De-Tan Skin Radiance Mask - Pack Of 2,Foxtale,818,25,4.4
Wishcare Lip Balm Combo - Tinted SPF 50+++ & Natural,Wishcare,472,21,4.4
d'you Inbalance Soothing Milky Toner,d'you,2100,0,4.7
Mario Badescu Acne Spot Corrector Drying Lotion with Salicylic Acid,Mario Badescu,1800,0,4.1
Mamaearth Beetroot Tinted Lip Balm with Beeswax for 12 Hour Moisturization,Mamaearth,275,8,4.2
"Nat Habit Brightening Ubtan Face Wash, Tikta for Dull Skin, Anti Aging with Wild Turmeric, All Skin",Nat Habit,264,30,4.4
Dermatouch Kojic Acid 1% Soap With Glutathione,Dermatouch,136,20,4.5
Aqualogica Detan+ Smoothie Face Wash with Glycolic Acid & Cherry Tomato for Tan removal,Aqualogica,237,5,4.3
VT Cosmetics Reedle Shot 100,VT Cosmetics,2639,12,4.7
"Dr. Sheth's Ceramide & Vitamin C Brightening Face Wash |Cleanses, Hydrates, Reduces Dark Spots 100ml",Dr. Sheth's,314,10,4.3
"O3+ Brightening Facial Single Dose Kit for Glow Boosting, Reducing Uneven Skin Tone | All Skin Types",O3+,521,7,4.3
Colorbar Spotlight Illuminating Lotion,Colorbar,796,20,4.3
Cetaphil Bright Healthy Radiance Day And Night Cream,Cetaphil,2390,8,4.3
PAC Aqua Blast - Water Based Moisturizer Mini,PAC,475,0,4.4
mCaffeine Super Glow Flash Facial 25% AHA+BHA+PHA Face Mask,MCaffeine,527,12,4.1
Foxtale Essentials Sheet Masks,Foxtale,89,10,4.4
Earth Rhythm Reusable Makeup Remover & Cleansing Pads For Women - Pack Of 2,Earth Rhythm,149,25,4.5
L'Occitane Shea Butter Hand Cream,L'Occitane,1050,0,4.5
Plix Pineapple 3% Hyloglo PHA Alcohol Free Face Toner,Plix,379,11,4.4
