Product Name,Brand,Final Price,Discount,Rating
"Neutrogena Hydro Boost Hyaluronic Acid Water Gel Light Face Moisturizer For Normal, Dry & Oily Skin",Neutrogena,1071,10,4.5
"CeraVe Moisturizer For Dry Skin with Ceramides, Niacinamide & Hyaluronic Acid for Barrier Repair",CeraVe,387,10,4.4
Dot & Key Mango Detan Oil-Free Sunscreen Gel SPF 50+ PA+++ With Alpha-Arbutin & Niacinamide,Dot & Key,387,13,4.5
Forest Essentials Delicate Facial Cleanser - Kashmiri Saffron & Neem,Forest Essentials,1295,0,4.5
"Eucerin Anti-Pigment Dual Serum With Thiamidol & Hyaluronic Acid , Reduces Dark Spots & Rejuvenates",Eucerin,3213,15,4.2
SKIN1004 Madagascar Centella Tone Brightening Capsule Serum,SKIN1004,899,10,4.4
The Ordinary Niacinamide 10% + Zinc 1%,The Ordinary,600,0,4.4
Estee Lauder Advanced Night Repair Synchronized Multi-Recovery Complex With Hyaluronic Acid (Serum),Estee Lauder,4500,0,4.3
O3+ D -TAN Face Pack for Tan Removal & Glowing Skin - Detan Mask for All Skin Types,O3+,1442,7,4.3
"CeraVe Foaming Cleanser Face Wash For Oily Skin with Ceramides, Dermatologist Recommended",CeraVe,468,10,4.4
Cetaphil Gentle Skin Cleanser,Cetaphil,399,7,4.5
The Ordinary Glycolic Acid 7% Exfoliating Solution,The Ordinary,1275,0,4.4
"Dot & Key Vitamin C + E Face Sunscreen SPF 50 PA+++ For Glowing Skin, 100% No White Cast",Dot & Key,387,13,4.4
Simple Kind To Skin Refreshing Facial Wash,Simple,357,15,4.5
COSRX Advanced Snail 96 Mucin Power Essence,COSRX,1450,0,4.5
Dot & Key Strawberry Dew Tinted Sunscreen SPF 50+ PA++++,Dot & Key,489,11,4.5
"Foxtale De-Tan Skin Radiance Mask, With Lactic Acid, Brazilian Purple Clay & Kaolin Clay",Foxtale,463,15,4.4
Ponds Super Light Gel Oil Free Moisturiser With Hyaluronic Acid + Vitamin E,Ponds,417,30,4.5
"Dot & Key Vitamin C + E Super Bright Face Moisturizer For Glowing Skin, Fades Dark Spots",Dot & Key,426,14,4.4
Dot & Key Watermelon & Hyaluronic Face Sunscreen SPF 50 PA+++ - 100% No White Cast & Waterlight,Dot & Key,387,13,4.4
"Plum 3% Niacinamide Toner With Rice Water, For Pores & Blemishes, Normal To Oily Skin Type",Plum,378,14,4.4
Lakme Absolute Perfect Radiance Skin Brightening Day Creme,Lakme,279,30,4.3
Minimalist 10% Vitamin C Serum For Face For Glowing Skin,Minimalist,664,5,4.4
Plum 10% Niacinamide Brightening Face Serum With Rice Water & Ferment - Fades Blemishes & Acne Marks,Plum,756,11,4.4
Minimalist 10% Niacinamide Face Serum With Matmarine + Zinc For Reducing Oil & Blemishes,Minimalist,569,5,4.4
d'you In My Defence Moisturiser Mini,d'you,3500,0,4.4
"TONYMOLY Korean Wonder Ceramide Mochi Toner-Hydrates, Softens, Nourishes Dry & Combination Skin",TONYMOLY,1275,15,4.5
Beauty of Joseon Relief Sunscreen Rice + Probiotics SPF 50+ PA++++,Beauty of Joseon,1570,0,4.4
Cetaphil Oily Skin Cleanser,Cetaphil,643,8,4.5
CeraVe Blemish Control Cleanser with 2% Salicylic Acid & Niacinamide for Acne-prone skin,CeraVe,1250,0,4.5
"Neutrogena Hydro Boost Hyaluronic Acid Water Gel Light Face Moisturizer For Normal, Dry & Oily Skin",Neutrogena,1071,10,4.5
The Ordinary AHA 30% + BHA 2% Peeling Solution,The Ordinary,950,0,4.4
"Dot & Key Hyaluronic + Ceramide Barrier Repair Hydrating Face Moisturizer Cream, Normal To Dry Skin",Dot & Key,336,15,4.4
The Ordinary GF 15% Solution,The Ordinary,1550,0,4.7
Cetaphil Moisturising Cream,Cetaphil,595,11,4.5
The Derma Co 1% Hyaluronic Sunscreen Spf 50 Pa+++ Aqua Gel For Normal To Oily Skin,The Derma Co,424,15,4.5
LANEIGE Lip Glowy Balm,LANEIGE,675,10,4.6
Cetaphil Bright Healthy Radiance Perfecting Serum 7X Power With Antioxidant C & Advanced Peptide,Cetaphil,1954,15,4.4
Minimalist 2% Salicylic Acid + LHA Face Cleanser With Zinc For Reducing Sebum & Acne,Minimalist,284,5,4.4
LANEIGE Glaze Craze Tinted Lip Serum,LANEIGE,1093,5,4.7
Plum 2% Niacinamide And Rice Water Moisturiser - Lightweight Gel Cream For Oil-Free Hydration,Plum,478,9,4.4
"La Shield SPF 40 Mineral Sunscreen Gel Oil free Matte PA +++ For Acne Prone, Oily Skin",La Shield,723,15,4.5
Clinique Moisture Surge 100h Auto-replenishing Hydrator (Moisturizer),Clinique,2250,0,4.5
Dr. Sheth'S Ceramide & Vitamin C Sunscreen Spf 50 Pa+++ No White Cast For All Skin Type,Dr. Sheth's,449,10,4.4
"Dot & Key 10% Vitamin C + E Face Serum With 5% Niacinamide, Fights Pigmentation & Dark Spots",Dot & Key,429,14,4.3
"The Derma Co 2% Kojic Acid Face Serum for Dark spots reduction, Pigmentation & Blemishes",The Derma Co,449,10,4.3
Minimalist SPF 50 PA ++++ Sunscreen With Multi-Vitamin For Reducing Photoaging & No White Cast,Minimalist,379,5,4.3
Wishcare Tinted Ceramide Lip Balm with SPF50 PA+++ - Kojic Acid & Niacinamide - For Lip Lightening,Wishcare,248,17,4.4
The Face Shop Rice Water Bright Foaming Cleanser,The Face Shop,899,0,4.5
SKIN1004 Madagascar Centella Serum,SKIN1004,899,10,4.6
Minimalist 2% Salicylic Acid Face Serum For Blackheads & Whiteheads,Minimalist,522,5,4.4
Nykaa Naturals Skin Secrets Exotic Indulgence Sheet Mask,Nykaa Skin,80,20,4.5
Foxtale Glow Sunscreen SPF 50 PA++++ with Vitamin C & Niacinamide for a Dewy Glow,Foxtale,304,13,4.4
L'Oreal Paris Glycolic Bright 8% [Melasyl + Niacinamide] Face Serum for Brightening Dark Spots,L'Oreal Paris,674,10,4.3
Cetaphil Moisturising Lotion For Dry To Normal Sensitive Skin - Dermatologist Recommended,Cetaphil,558,10,4.5
Neutrogena Ultrasheer SPF50+ PA++++ Ultra Light Moisturizing Face Sunscreen Oily & Sensitive Skin,Neutrogena,649,17,4.4
Beauty of Joseon Revive Eye Serum,Beauty of Joseon,1490,0,4.4
"Ponds Youthful Miracle Hexyl Retinol Complex, Renew & Repair Day Cream, SPF 15 PA++",Ponds,584,35,4.4
COSRX Advanced Snail Mucin 92 All In One Cream with Hyaluronic Acid,COSRX,1650,0,4.5
Minimalist Vitamin B5 10% Moisturizer,Minimalist,332,5,4.4
Wishcare Niacinamide Oil Balance Fluid Sunscreen Light & Matte SPF 50+ PA++++ For Balances Oily & Protects Skin,Wishcare,399,20,4.4
Raaga Professional De-Tan Removal Cream,Raaga Professional,373,10,4.4
Beauty of Joseon Relief Sun Aqua-Fresh Add SPF 50+ PA++++ Rice + B5,Beauty of Joseon,1570,0,4.5
LANEIGE Lip Sleeping Mask Berry,LANEIGE,540,10,4.6
Deconstruct Lightweight Gel Sunscreen SPF 55+ PA+++,Deconstruct,314,10,4.4
CeraVe Oil Control Gel-Cream lightweight moisturizer for Oily & Combination Skin with Shine Control,CeraVe,1140,5,4.5
"Plum Bestselling 2% Niacinamide & Rice Water SPF 50 PA+++ Sunscreen, For Oily, Normal & Dry Skin",Plum,363,9,4.3
TONYMOLY Korean Face Sheet Mask,TONYMOLY,100,0,4.6
Garnier Skin Naturals Micellar Oil-Infused Cleansing Water For Cleansing & Make-Up Removal | 400ml,Garnier,399,20,4.5
The Pink Foundry Overnight Acne Spot Corrector,The Pink Foundry,467,15,4.1
Dot & Key Vitamin C + E Super Bright Gel Face Wash,Dot & Key,214,14,4.4
"CeraVe Hydrating Cleanser Non-Foaming Face Wash for Dry Skin with Ceramides, Dermatologist Recommend",CeraVe,297,10,4.4
Wishcare Sunscreen Body Lotion SPF 50 Broad Spectrum PA+++ UVA & UVB Protection - Body Sunscreen,Wishcare,399,20,4.4
Glycolic Bright Glowing Day Cream SPF 30,L'Oreal Paris,759,5,4.3
Deconstruct Lightweight Gel Sunscreen SPF 55+ PA+++,Deconstruct,314,10,4.4
Plum 15% Vitamin C Face Serum with Mandarin for Glowing Skin with Pure Ethyl Ascorbic Acid,Plum,703,11,4.4
Minimalist 2% Alpha Arbutin Face Serum With Butylresorcinol & Ferulic Acid For Hyperpigmentation,Minimalist,522,5,4.4
Reequil 0.1% Retinol Night Creamtreat For Wrinkles & Skin Tightening,Re'equil,375,5,4.3
Dot & Key Barrier Repair + Hydrating Gentle Face Wash,Dot & Key,214,14,4.5
"Dot & Key Cica Salicylic & Green Tea Facewash For Acne Prone Skin, Cleanses Pores & Excess Oil",Dot & Key,214,14,4.4
"Plum BodyLovin' Vanilla Caramello Bestselling Body Lotion for Dry, Normal & All Skin type",Plum,409,14,4.5
The Face Shop Rice & Ceramide Moisturizer - Korean Day Cream for Barrier Repair & Glass Skin Glow,The Face Shop,988,5,4.4
Embryolisse Lait-Creme Concentre,Embryolisse,1373,10,4.5
The Derma Co 10% Vitamin C Face Serum Reduces Pigmentation & Glowing Skin For All Skin Types,The Derma Co,571,12,4.3
Aqualogica Glow+ Dewy Lightweigh Sunscreen Gel SPF 50+ PA++++ with Papaya & Vitamin C,Aqualogica,404,10,4.4
"Clinique Moisture Surge Active Glow Serum with Vitamin C, Lactic Acid & Hyaluronic Acid",Clinique,4500,0,5.0
Cetaphil Brightening Night Protection Cream With Niacinamide Reduces Dark Spots- Dermatologist Tested,Cetaphil,1169,10,4.3
"The Face Shop Rice & Ceramide Moisturizing Emulsion, Locks Skin Moisture & Strengthens Skin Barrier",The Face Shop,941,5,4.5
The Derma Co Sali-Cinamide Anti-Acne Face Wash with 2% Salicylic Acid & 2% Niacinamide,The Derma Co,232,7,4.4
Vaseline Gluta Hya Antioxidant SPF 50 PA+++ Sunscreen,Vaseline,489,30,4.5
Nykaa Wanderlust Fragrance Moisturising Body Lotion,Wanderlust,440,20,4.4
"Plum 2% Niacinamide Face Wash With Rice Water For Oily Skin, Brightens & Hydrates",Plum,272,9,4.4
Dot & Key CSMS Vitamin C Bestseller Combo,Dot & Key,1387,20,4.4
Aminu Eye Serum,Aminu,1850,0,4.4
"Deconstruct 10% Vitamin C Face Serum with 0.5% Ferulic Acid, for Glowing Skin, Beginner-friendly",Deconstruct,615,23,4.3
"Anua Niacinamide 10 Txa 4 Serum, Brightening Korean Serum For Dark Spots & Hyperpigmentation",Anua,2000,0,4.6
"Plum BodyLovin' Vanilla Caramello Bestselling Body Lotion for Dry, Normal & All Skin type",Plum,409,14,4.5
Kama Ayurveda Pure Rose Water (Toner),Kama Ayurveda,1775,0,4.5
Dot & Key Blueberry Hydrating Barrier Repair Face Sunscreen SPF 50+ PA++++ - 100% No White Cast,Dot & Key,387,13,4.4
Dot & Key Cica Calming Niacinamide Face Sunscreen SPF 50 PA+++ For Oily Acne Prone & Sensitive Skin,Dot & Key,387,13,4.3
"Cetaphil Sun SPF 50+ Light Gel Very High Protection Mineral Base for All Skin Types, Sensitive Skin",Cetaphil,1064,10,4.3
Bobbi Brown Vitamin Enriched Face Base (Moisturizer & Primer),Bobbi Brown,7450,0,4.5
Minimalist 10% Vitamin C Serum For Face For Glowing Skin For Beginners,Minimalist,284,5,4.4
Beauty Of Joseon Glow Deep Serum For Pigmentation - Rice + Arbutin,Beauty of Joseon,1490,0,4.4
NIVEA Deep Moisture Serum Vit E Body Lotion 48H Intense Moisturization Almond Oil Dry - Very Dry Skin,NIVEA,570,25,4.5
Klairs Freshly Juiced Vitamin Drop - Pure Vitamin C Serum,Klairs,1413,10,4.3
Vaseline Lip Tins,Vaseline,221,25,4.5
Minimalist 8% Glycolic Acid Toner For Exfoliates Smoothes Skin,Minimalist,474,5,4.4
Foxtale Brightening Vitamin C Face Serum With L-Ascorbic Acid And Vitamin E For Glowing Skin,Foxtale,476,20,4.2
The Ordinary Multi-Peptide + Copper Peptides 1% Serum,The Ordinary,2950,0,4.5
Clayco Rice & Sake Sleeping Mask Night Gel Cream With Vitamin C For Brightening & Hydration,ClayCo,1099,0,4.4
Dot & Key Retinol + Ceramide Sleep Treatment Anti-Ageing Night Cream For Fine Lines & Wrinkles,Dot & Key,570,18,4.4
Dot & Key Barrier Repair Hydrating Lip Balm SPF 50 With Ceramides & Peptides Strawberry Red,Dot & Key,199,20,4.4
52 Sundaze SPF 50+ Rosewater Sun Mist,52 Sundaze,679,15,4.6
"Bioderma Atoderm Creme Ultra-Nourising Moisturising Cream Boosts Hyaluronic Acid, Ceramides",Bioderma,629,10,4.5
Minimalist Vitamin K + Retinal 01% Under Eye Cream With Caffeine 03% For Dark Circle & Puffiness,Minimalist,474,5,4.3
Cetaphil DailyAdvance Ultra Hydrating Lotion,Cetaphil,636,9,4.4
Murad Vita - C Glycolic Serum,Murad,7500,0,4.3
Bioderma Cleanser - Sebium Gel Moussant - Acne Defence Cleanser For Oily Acne Prone Skin,Bioderma,809,10,4.5
Dot & Key Strawberry Bright 10% Niacinamide Face Serum,Dot & Key,521,13,4.6
The Derma Co 10% Niacinamide Face Serum For Acne Marks,The Derma Co,527,12,4.3
Minimalist Retinol 0.3% Face Serum,Minimalist,569,5,4.4
Brightening Body Wash With Glycolic Acid & Niacinamide For Glowing Skin,Foxtale,319,20,4.4
TONYMOLY Korean Pureness Face Sheet Mask,TONYMOLY,100,0,4.5
Wanderlust Peach & Almond Hand and Nail Cream with Avocado + Hyaluronic Acid,Wanderlust,199,33,4.3
Innisfree Pore Clearing Clay Mask 2X With Volcanic Clusters,Innisfree,880,20,4.5
AXIS-Y Dark Spot Correcting Glow Serum,AXIS-Y,1550,0,4.4
"Be Bodywise Pigmentation Removal Cream With 2.5% Lactic Acid, 2% Urea, Retinol - Treats Dark Patches",Be Bodywise,549,15,4.3
L'Oreal Paris Revitalift Hydrating Serum With 1.5 % Hyaluronic Acid,L'Oreal Paris,849,15,4.4
"VILVAH Milk Drops Skin Brightening Serum With Rice Milk, Marine Algae Extract & Alpha-Arbutin",VILVAH,640,0,4.2
Dot & Key Cica Niacinamide & Ceramides Oil-Free Face Moisturizer For Acne Prone & Oily Skin,Dot & Key,426,14,4.4
Wishcare 10% AHA Blend + 1% Salicylic Acid Glycolic & Lactic Acid Body Lotion With Niacinamide For De Tan,Wishcare,399,20,4.4
ClayCo Matcha Enzyme Dead Skin Removal Scrub,ClayCo,799,0,4.2
"CeraVe Moisturizing Body Lotion for Normal to Dry skin with Ceramides, Dermatologist recommended",CeraVe,1663,5,4.5
Raaga Professional De-Tan Removal Cream,Raaga Professional,373,10,4.4
"Hyphen All I Need Sunscreen SPF50 PA++++, Brightens -Niacinamide Vit C Rich Kakadu Plum",Hyphen,427,5,4.1
Simple Refreshing Facial Wash Combo,Simple,689,18,4.5
Aqualogica Radiance+ Dewy Lightweight Sunscreen Gel SPF 50+ PA+++ for Oily & Acne-Prone Skin,Aqualogica,404,10,4.4
Plum Green Tea Pore Cleansing Gel Face Wash With Glycolic Acid - Fights Acne & Oil For Clear Skin,Plum,320,11,4.5
"O3+ D-TAN Face Pack for Tan Removal, Brightening & Glow Boosting | For All Skin Types",O3+,772,7,4.3
The Face Shop Real Nature Face Mask,The Face Shop,100,0,4.5
The Derma Co Sali-Cinamide Anti-Acne Face Wash with 2% Salicylic Acid & 2% Niacinamide,The Derma Co,232,7,4.4
"Vaseline Cocoa Glow Serum In Lotion, 600 ml , 100% Pure Cocoa & Shea Butter for Glowing & Soft Skin",Vaseline,519,35,4.5
Foxtale 12% Niacinamide Clarifying Serum Acne & Blemish Control,Foxtale,516,20,4.3
Minimalist Daily Skincare Routine For Oily & Acne Prone Skin CSMS Combo,Minimalist,1481,10,4.4
Bioderma Pigmentbio Foaming Cream Brightening Exfoliating Cleanser,Bioderma,899,10,4.4
Foxtale Oil Balancing Moisturizer Azelaic Acid & Niacinamide,Foxtale,387,13,4.6
Be Bodywise 20% Urea Foot & Heel Roll On For Dry Feet & Cracked Heels With Urea & Lactic Acid,Be Bodywise,399,0,4.6
Bioderma Dermatological Micellar Water Sensibio H2O - Gently Removes Makeup Prevents Clogged Pores,Bioderma,1039,20,4.6
Minimalist 16% Vitamin C Face Serum With Vitamin E & Ferulic Acid For Advanced Users,Minimalist,569,5,4.3
"Innisfree Super Volcanic Pore Clay Mask 2X For Clogged Pores, Oil Control, Excess Sebum & Blackhead",Innisfree,880,20,4.5
Beauty Of Joseon Glow Serum - Propolis + Niacinamide,Beauty of Joseon,1490,0,4.4
Plum BodyLovin' Vanilla Vibes Body Oil - Intense Moisture & Instant Glow,Plum,257,14,4.5
"Bioderma Niacinamide Moisturizer - Atoderm Creme Ultra-Boosts Hyaluronic Acid, Ceramides",Bioderma,1169,10,4.5
"CeraVe Moisturizer For Dry Skin, Barrier Repair Cream with Ceramides, Dermatologist recommended",CeraVe,1442,7,4.5
The Derma Co 1% Kojic Acid Face Wash I Reduces Dark Spots & Pigmentation | Cleanses & Brightens Skin,The Derma Co,275,8,4.3
inde wild Dewy Lip Balms - Wedding Rose,inde wild,703,12,4.5
Cetaphil Brightening Radiance Creamy Cleanser With Niacinamide Reduces Dark Spots Dermatologist Tested,Cetaphil,719,10,4.4
Beauty of Joseon Red Bean Refreshing Pore Mask,Beauty of Joseon,1740,0,4.5
"Olay Retinol Anti Ageing Night Cream For Youthful Looking Skin, No Irritation, Fragrance Free",Olay,1299,35,4.4
ISDIN Fotoprotector Fusion Water Sunscreen SPF 50 UVB/UVA,ISDIN,2190,0,4.6
"Hyphen Tinted Lip Balm - Hazel, 1% Vit E, 2% Squalane & Peptides, Brightens, Moisturizes Dry Lips",Hyphen,379,5,4.1
"Vaseline Sun Protect SPF 30 Body Lotion, Reduces Tan Lines in 7 Days, UVA + UVB PA+++",Vaseline,479,45,4.4
COSRX The 6 Peptide Skin Booster Serum,COSRX,2050,0,4.5
Pilgrim 25% AHA 2% BHA 5% PHA Face Peeling Solution for Acne Scars,Pilgrim,548,15,4.3
Mamaearth Rice Face Wash With Rice Water & Niacinamide for Glass Skin,Mamaearth,242,10,4.4
"Dr. Sheth's Ceramide & Vitamin C Oil - Free Moisturizer to Hydrate, Brighten Skin",Dr. Sheth's,314,10,4.4
SKIN1004 Madagascar Centella Light Cleansing Oil,SKIN1004,629,10,4.4
Dot & Key 72Hr Hydrating Lightweight Gel Face Moisturizer With Hyaluronic Acid & Probiotics,Dot & Key,426,14,4.5
The Derma Co 2% Salicylic Acid Face Serum,The Derma Co,449,10,4.3
Cetaphil Brightening Day Protection Cream With Spf 15 Niacinamide Reduces Dark Spots-Dermatologisttested,Cetaphil,1169,10,4.2
Dot & Key Watermelon & Vitamin C SuperGlow Gel Face Wash For Glowing Skin & Spots Reduction,Dot & Key,214,14,4.4
Swiss Beauty Hydra Eye Serum Patches,Swiss Beauty,279,20,4.3
Raaga Professional De Tan Removal Creme With Kojic & Milk(500 gm),Raaga Professional,1346,10,4.4
Dot & Key Under Eye Cream,Dot & Key,406,18,4.3
Hyphen Golden Hour Glow Serum 56% Glow Hyphened All Skin Types,Hyphen,591,9,4.3
I'm From Rice Toner,I'm From,504,10,4.4
NIVEA Soft Vit E Light Non Sticky Face Moisturiser Cream Fresh & Hydrated Skin For All Skin Types,NIVEA,300,25,4.5
Ethiglo Skin Lightening Face Wash,Ethiglo,260,0,4.4
"Minimalist 2% Hyaluronic Acid + PGA Face Serum For Deep, Multilevel Hydration",Minimalist,569,5,4.5
Minimalist 10% Niacinamide Face Serum With Matmarine + Zinc For Reducing Oil & Blemishes,Minimalist,249,0,4.4
"CeraVe SA Smoothing Cleanser For Dry, Rough & Bumpy Skin, Face wash with Salicylic Acid & Ceramides",CeraVe,1163,7,4.4
Minimalist 5% Niacinamide Face Serum With Bifida Ferment & Oat Extract For Healing & Soothing Skin,Minimalist,569,5,4.4
The Ordinary Salicylic Acid 2% Solution,The Ordinary,600,0,4.4
LANEIGE Water Sleeping Mask EX,LANEIGE,1792,20,4.5
Biodance Bio-Collagen Real Deep Mask,Biodance,380,0,4.4
Celimax The Vita-A Retinal Shot Tightening Korean Booster,Celimax,2199,0,4.8
Nykaa Naturals Cleansing + Hydrating Face Wash,Nykaa Skin,223,20,4.3
Nykaa Naturals Skin Secrets Active Skin Solutions Sheet Mask,Nykaa Skin,80,20,4.5
Vaseline Intensive Care Deep Moisture Body Lotion,Vaseline,488,35,4.5
"Plix 1.20% Retinol & 1% Bakuchi Oil Pomegranate Anti Ageing Night Cream, Reduce Fine Line & Wrinkles",Plix,479,13,4.2
Conscious Chemist Daily Dissolve Ultra Light Makeup Remover Oil Cleanser For All Skin Type,Conscious Chemist,419,30,4.3
DOT & KEY GLOSS BOSS LIP BALM VITAMIN C + E SPF 50 CARAMEL KISS - 12G,Dot & Key,199,20,4.2
Lotus Professional Phyto-Rx Whitening & Brightening Creme SPF 25 PA+++,Lotus Herbals,644,18,4.4
Dove Deep Moisture Body Wash,Dove,392,30,4.5
Neutrogena Oil Free Acne Cleansing Face Wash with 2% Salicylic Acid for Acne Prone & Oily Skin,Neutrogena,749,12,4.3
Minimalist Light Fluid SPF 50 Face Sunscreen,Minimalist,474,5,4.4
The Ordinary Hyaluronic Acid 2% + B5,The Ordinary,1000,0,4.5
Beauty of Joseon Dynasty Cream,Beauty of Joseon,2090,0,4.4
The Face Shop Rice & Ceramide Face Toner - Korean Beauty Skincare for Moisture & Brightness,The Face Shop,854,5,4.4
Chemist At Play 3% AHA Gentle Exfoliating Face Scrub For Dead Skin & Blackheads,Chemist at Play,299,14,4.6
Re'equil Ceramide & Hyaluronic Acid Moisturiser For Normal To Dry Skin,Re'equil,280,5,4.4
Minimalist 7% ALA & AHA Brightening Face Wash With Vitamin B5 & Glycolic acid For Glowing Skin,Minimalist,379,5,4.3
"NIVEA Cell Repair 50X Vit C Sunscreen Natural Glow Body Lotion Reduces Tan, Brightens - Uva & Uvb",NIVEA,516,20,4.4
Beauty of Joseon Ginseng Essence Water,Beauty of Joseon,1570,0,4.5
LANEIGE Bouncy And Firm Sleeping Mask,LANEIGE,2080,20,4.5
"Bioderma Moisturizer Sebium Hydra for Oily, Acne-Prone Skin with Ceramides for 24H Hydration",Bioderma,1076,10,4.5
Foxtale Super Glow Face Wash Vitamin C + Papaya Enzyme,Foxtale,224,10,4.5
Sanfe Deep Purifying Nose Strips for Women Pack of 6 with Fuji Green Tea & Witch Hazel Extracts,Sanfe,122,28,4.2
The Ordinary Retinol 0.5% In Squalane,The Ordinary,875,0,4.4
The Face Shop Pomegranate & 10% Collagen Korean Beauty Moisturizer - Anti Aging Day & Night Cream,The Face Shop,2115,10,4.4
"Hyphen Ice Dunk Cooling Face Mask - 31% Cooling Actives, 3% Caffeine - Instant Depuff",Hyphen,569,5,4.5
The Ordinary Azelaic Acid Suspension 10%,The Ordinary,1150,0,4.3
Wishcare Ceramide Lip Balm With SPF 50 PA+++ Kojic Acid & Niacinamide For Lip Lightening Natural,Wishcare,248,17,4.4
"Plum Green Tea Toner With Glycolic Acid - Tightens Pores, Fights Pimples & Controls Oil Alcohol-Free",Plum,382,9,4.4
LANEIGE Cream Skin Cerapeptide Refiner,LANEIGE,810,10,4.5
Foxtale Nourishing Moisturiser With Niacinamide & Vit E for 24Hr Hydration,Foxtale,212,15,4.3
Cetaphil Brightness Refresh Toner Bright Healthy Radiance With Niacinamide Reduces Dark Spots Dermatologist Tested,Cetaphil,989,10,4.4
Garnier Skin Naturals Micellar Oil-Infused Cleansing Water For Cleansing & Make-Up Remover | 125ml,Garnier,234,15,4.6
Forest Essentials Soundarya Radiance Cream With 24K Gold And SPF25,Forest Essentials,6850,0,4.4
Chemist at Play Exfoliating Natural AHAs Body Scrub For Removing Tan & Dead Skin Cells-Coffee Body Scrubs,Chemist at Play,299,14,4.5
Chemist at Play Vitamin C Neck Knee Elbow Brightening Roll On for Men & Women,Chemist at Play,315,10,4.2
Fixderma Shadow Sunscreen SPF 50+ Gel For Oily Skin,Fixderma,544,15,4.4
NIVEA Tinted Lip Balm With Natural Oils & 24H Melt-In Moisture Cherry Shine,NIVEA,208,20,4.4
"Dot & Key 10% Niacinamide + Cica Face Serum For Oily, Acne Prone Skin & Dark Spots Reduction",Dot & Key,383,15,4.3
Nykaa Cosmetics Lip Crush Macaron Lip Balm,Nykaa Cosmetics,224,25,4.3
"Dot & Key Vitamin C Super Bright Foaming Face Wash For Glowing Skin, Oily & Dry Skin, Sulphate Free",Dot & Key,236,20,4.3
Plum Bulgarian Valley Rose Water Toner,Plum,204,20,4.4
"Foxtale Brightening Lip Balm With Peptides, Vitamin C & Hyaluronic Acid - Pink Glaze",Foxtale,226,18,4.4
Ahaglow Advanced Face Wash Gel,Ahaglow,537,5,4.4
"TONYMOLY Korean Wonder Rice Smoothing Toner-Hydrates, Brightens, Clarifies Dry & Combination Skin",TONYMOLY,1275,15,4.5
Pilgrim 10% Vitamin C Face Serum For Daily Brightness,Pilgrim,463,15,4.5
Minimalist 5% Marula Oil Moisturizer With Hyaluronic Acid & Vitamin F & E For Dry Skin,Minimalist,284,5,4.4
Nykaa Naturals Skin Secrets Indian Rituals Sheet Mask,Nykaa Skin,70,30,4.5
Foxtale Vitamin-C Super Glow Moisturiser With Niacinamide & Peptides For Glowing Skin,Foxtale,347,22,4.3
"Foxtale Hydrating Cleanser And Make-Up Remover, With Hyaluronic Acid",Foxtale,269,23,4.4
"Olay Total Effects Day Cream With Spf 15, Fights 7 Signs Of Ageing With Niacinamide",Olay,899,10,4.4
Dot & Key Ceramide & Peptide Barrier Repair SPF 50 PA+++ Tinted Lip Balm For Plump Lips,Dot & Key,189,24,4.4
"Ponds Bright Beauty Facewash with Niacinamide, For Glass Skin-like Shine",Ponds,249,45,4.4
Dr. Sheth's Kesar and Kojic Acid Sunscreen with SPF 50+ PA++++ for Pigmentation and All Skin Types,Dr. Sheth's,629,10,4.3
Deconstruct Brightening Lip Balm With 1% Vitamin C & 0.1% Resorcinol SPF 30+ Hydrates & Brightens Dry & Pigmented Lips,Deconstruct,189,5,4.2
The Derma Co 1% Salicylic Acid Face Wash for Active Acne with Salicylic Acid & Witch Hazel,The Derma Co,275,8,4.3
"Plix 0.5% Salicylic Acid Jamun Face Wash Cleanser For Active Acne & Oil Control, Acne Breakouts",Plix,329,12,4.3
"O3+ Bridal Radiant Facial Kit With Hyaluronic & Niacinamide For Glowing Skin, For All Skin Types",O3+,921,7,4.4
Episoft AC Moisturiser SPF 30 With Microencapsulated Sunscreen,Episoft,597,12,4.5
Neutrogena Visible Repair Retinol + Peptide Anti-Ageing Day & Night Cream For Wrinkles & Fine Lines,Neutrogena,1470,13,4.3
Foxtale Dewy Sunscreen SPF 70 PA++++ With Niacinamide + Provitamin B5 + Vitamin E,Foxtale,421,15,4.3
Lakme Absolute Perfect Radiance Serum With 7% Pure Niacinamide For 2X Skin Brightening,Lakme,454,30,4.3
Minimalist 10% Multi Peptide Face Serum For Anti Aging & Collagen Boost With Bio-Placenta,Minimalist,664,5,4.4
Caudalie Vinoperfect Brightening Dark Spot Serum,Caudalie,6250,0,4.4
"Olay Super Collagen Peptides Moisturizer For Firm & Lifted Skin, Reduces 5 Signs Of Ageing",Olay,1399,30,4.9
Minimalist 3% Tranexamic Acid Face Serum For Melasma- Acne Scars- Hyperpigmentation Or Erythema (PIH/PIE),Minimalist,617,5,4.3
The Ordinary Ascorbyl Glucoside Solution 12% (Vitamin C),The Ordinary,1450,0,4.4
Garnier Vitamin C + Face Serum for Skin Brightening with 2% Niacinamide & 0.5% Salicylic Acid,Garnier,740,20,4.3
"Anua Heartleaf Pore Control Cleansing Oil Removes Makeup, Excess Sebum, Blackheads & Clogged Pores",Anua,1650,0,4.8
"Plum Green Tea Night Gel Cream With Glycolic Acid, Fights Acne For Clear, Oil-Free, Youthful Skin",Plum,523,9,4.4
The Ordinary Alpha Arbutin 2% + HA Face Serum,The Ordinary,1200,0,4.6
Innisfree Volcanic Clusters Foaming Pore Cleanser For Clogging Impurities,Innisfree,640,20,4.5
Estee Lauder Revitalizing Supreme+ Youth Power Creme Moisturizer with Hyaluronic Acid & Caffeine,Estee Lauder,11700,0,4.5
"PLIX 5% Pineapple Foaming Facewash For Depigmentation, For Skin Brightening & Even Toned Complexion",Plix,329,12,4.2
Cetaphil Baby Daily Lotion With Shea Butter Vitamin E & Pro Vitamin B5,Cetaphil,884,7,4.5
"Kiehl's Ultra Facial Cream With 24 Hour Hydration - Moisturizer For Softer, Hydrated Skin",Kiehl's,3000,0,4.5
Anua Azelaic Acid 10 Hyaluron Redness Soothing Serum with Cica Soothes & Calms Acne-Prone Skin,Anua,2000,0,4.8
The Ordinary Caffeine Solution 5% + EGCG,The Ordinary,900,0,4.3
Plum 10% Vitamin C Barrier Boosting + Glow Serum with Calendula For Glowing Skin,Plum,591,9,4.6
Dot & Key Watermelon & Glycolic Super Glow Pore Tightening Toner For Uneven Skintone,Dot & Key,320,19,4.3
Plum Besteller Niacinamide CSMS Combo for Bright & Non-Oily Hydration,Plum,1336,15,4.4
COSRX AHA/BHA Clarifying Treatment Toner,COSRX,1090,0,4.4
"TONYMOLY Korean Wonder Ceramide Mochi Toner-Hydrates, Softens, Nourishes Dry & Combination Skin",TONYMOLY,575,0,4.5
The Derma Co Sali-Cinamide Anti-Acne Face Wash with 2% Salicylic Acid & 2% Niacinamide,The Derma Co,395,12,4.4
Cetaphil Pro Oil Control Foam Face Wash For Oily Sensitive Skin,Cetaphil,977,7,4.4
Foxtale SPF 70 Gel-Cream Sunscreen for Oily Skin with PA++++ & Niacinamide,Foxtale,506,15,4.4
